序号,学科门类,学校名称,项目类别,项目名称,申请人,年份
1934,经济学,天津师范大学,规划基金项目,城市水资源的循环经济发展模式及动态经济调控机制研究,荆平,2011
1935,经济学,皖西学院,规划基金项目,基于GIS的生态补偿及分配模型研究—以安徽省会经济圈为,孙贤斌,2011
1936,经济学,潍坊学院,规划基金项目,山东半岛蓝色经济区建设的关键问题研究,刘勇,2011
1937,经济学,潍坊学院,规划基金项目,基于效率与公平的城乡居民收入差距收敛的理论模型和系统动力学仿真研究,郑明亮,2011
1938,经济学,温州大学,规划基金项目,民间资本与小额贷款公司可持续发展的相关性研究,杨福明,2011
1939,经济学,武汉大学,规划基金项目,住房价格波动、消费与中国最优货币政策选择：基于异质性预期视角,肖卫国,2011
1940,经济学,武汉大学,规划基金项目,中国对外经济失衡的指标测度、突变影响及再平衡的路径评估研究,刘威,2011
1941,经济学,武汉大学,规划基金项目,金融自由化对中国贫困的影响途径与数量测度,陈志刚,2011
1942,经济学,武汉工业学院,规划基金项目,中国民间资本转化为私募股权投资的影响因素分析及策略研,张旭波,2011
1943,经济学,武汉理工大学,规划基金项目,中国现阶段贫富差距与社会和谐的动态关联研究,彭定贇,2011
1944,经济学,武汉理工大学,规划基金项目,FDI与服务业生产率增长的实证研究,赵迎红,2011
1945,经济学,西安建筑科技大学,规划基金项目,支撑我国西北地区经济可持续发展的水环境承载力研究,刘晓君,2011
1946,经济学,西安交通大学,规划基金项目,我国证券市场操纵交易模式挖掘及操纵行为识别研究,李淑彪,2011
1947,经济学,西安交通大学,规划基金项目,我国航班延误的决定因素及治理补救机制研究,杨秀云,2011
1948,经济学,西安交通大学,规划基金项目,不对称信息下垄断行业的激励性规制改革的路径及政策优化选择研究,张帆,2011
1949,经济学,西安交通大学,规划基金项目,考虑环境效应的中国省际能源效率问题研究,屈小娥,2011
1950,经济学,西北农林科技大学,规划基金项目,西北地区典型农村生活垃圾集中处理协同治理机制研究,陆迁,2011
1951,经济学,西藏大学,规划基金项目,西藏林芝地区典型景区生态旅游环境容量监测与安全预警模式研究,马守春,2011
1952,经济学,西藏大学,规划基金项目,西藏冬虫夏草资源对农牧民消费的影响研究,卓嘎,2011
1953,经济学,西南财经大学,规划基金项目,度量模型与管理模型整合下操作风险监管资本控制研究,莫建明,2011
1954,经济学,西南大学,规划基金项目,二元经济结构下统筹城乡金融协调发展研究,王定祥,2011
1955,经济学,西南交通大学,规划基金项目,城市再生资源回收行为空间属性研究,吴刚,2011
1956,经济学,西南交通大学,规划基金项目,人民币国际化资本项目开放下新兴洗钱行为与对策研究,高增安,2011
1957,经济学,西南交通大学,规划基金项目,社会责任、商业道德与公司治理研究,叶勇,2011
1958,经济学,西南科技大学,规划基金项目,促进西部经济一体化的产业集群政策研究：以成渝经济一体化为例,俞培果,2011
1959,经济学,西南民族大学,规划基金项目,产业转移背景下西部地区战略性新兴产业成长研究,安果,2011
1960,经济学,厦门大学,规划基金项目,包容性增长视角下的中国式城市化：理论、经验与对策,邵宜航,2011
1961,经济学,厦门大学,规划基金项目,股指期货市场机制研究与风险监控体系的构建,刘振涛,2011
1962,经济学,厦门理工学院,规划基金项目,大陆与台湾经济周期的同步性及传导机制研究,孙晓娟,2011
1963,经济学,湘潭大学,规划基金项目,建筑垃圾循环利用产业发展研究,高青松,2011
1964,经济学,新疆农业大学,规划基金项目,新疆农村少数民族劳动力转移区位选择与影响机制研究,杨红,2011
1965,经济学,信阳师范学院,规划基金项目,新生代农民工“半市民化”问题研究,丁静,2011
1966,经济学,徐州师范大学,规划基金项目,多维视角下服务业发展路径研究：产业结构调整、区域性和阶段化,蒋昭侠,2011
1967,经济学,烟台大学,规划基金项目,基于日本模式的我国大城市圈铁路建设与区域开发路径创新,孙志毅,2011
1968,经济学,扬州大学,规划基金项目,中国R&D投入模式变迁及其技术创新绩效研究,吕燕,2011
1969,经济学,扬州大学,规划基金项目,基于C租金理论假设的企业竞争战略目标模式和绩效测量研,潘成云,2011
1970,经济学,云南财经大学,规划基金项目,农田水利建设与运营的模式创新和机制设计研究：以云南为,叶文辉,2011
1971,经济学,云南大学,规划基金项目,巨灾风险分散模式以及防御体系的研究,何树红,2011
1972,经济学,浙江财经学院,规划基金项目,城市群空间组织与产业空间分异互动机制与调控模式研究,崔大树,2011
1973,经济学,浙江财经学院,规划基金项目,我国运用税收政策促进企业R&D投资的有效性研究,刘初旺,2011
1974,经济学,浙江财经学院,规划基金项目,公共支出受益归宿研究——基于浙江的调查,赵海利,2011
1975,经济学,浙江财经学院,规划基金项目,利益集团、地方融资冲动与区域金融中心建设：基于政治经济分析框架的博弈研究,吴宏,2011
1976,经济学,浙江财经学院,规划基金项目,村级财务治理机制创新与实践路径研究,潘自强,2011
1977,经济学,浙江财经学院,规划基金项目,基于多智能主体演化仿真的战略性新兴产业政策研究,金通,2011
1978,经济学,浙江财经学院,规划基金项目,基于阶段性补偿激励视角的新型农村合作医疗筹资与保障机制研究,任坐田,2011
1979,经济学,浙江财经学院,规划基金项目,我国制造业空间集聚、结构演进与地方保护行为——理论分析与实证研究,邱风,2011
1980,经济学,浙江大学,规划基金项目,我国经济低碳化转型中的碳金融发展问题研究,姚明龙,2011
1981,经济学,浙江大学城市学院,规划基金项目,商业银行外汇结构性存款定价的蒙特卡罗模拟方法及其应用,马俊海,2011
1982,经济学,浙江工商大学,规划基金项目,居民收入差距适度性测度与预警研究,孙敬水,2011
1983,经济学,浙江工商大学,规划基金项目,基于税收归宿视角的收入再分配理论与实证研究,郭宏宝,2011
1984,经济学,浙江工商大学,规划基金项目,科技金融推动战略性新兴产业发展的机制创新研究,钱水土,2011
1985,经济学,浙江工业大学,规划基金项目,地方政府土地财政依赖：形成机理与转型对策,陈多长,2011
1986,经济学,浙江工业大学,规划基金项目,产业国际化促进经济增长的机制与边际效应实证研究,姚利民,2011
1987,经济学,浙江农林大学,规划基金项目,中国农产品对外贸易成本测度、决定因素及政策研究,蒋琴儿,2011
1988,经济学,浙江农林大学,规划基金项目,收入差距扩大背景下农业劳动生产率地区差异演进的驱动因素研究,余康,2011
1989,经济学,浙江农林大学,规划基金项目,不同农业规模经营模式比较研究：基于多功能农业视角与系统思考方法,姬亚岚,2011
1990,经济学,浙江师范大学,规划基金项目,集群企业转移的去地方化问题与转型升级研究,朱华友,2011
1991,经济学,浙江万里学院,规划基金项目,产业集群影响技术创新的边界条件解析及其实证：知识交换的视角,谢子远,2011
1992,经济学,中国海洋大学,规划基金项目,环境责任保险费率厘定模型研究与实证检验,游桂云,2011
1993,经济学,中国海洋大学,规划基金项目,金融不稳定指标体系及其对宏观经济影响的测度模型研究,王元月,2011
1994,经济学,中国海洋大学,规划基金项目,基于功能优化的我国外汇储备投资收益与风险评价研究,魏晓琴,2011
1995,经济学,中国矿业大学,规划基金项目,政府规制下煤炭资源整合路径选择及其经济效果研究,孙自愿,2011
1996,经济学,中国人民大学,规划基金项目,激活我国商品房租赁市场沉淀房源、优化供给政策研究,叶剑平,2011
1997,经济学,中国人民大学,规划基金项目,基于成本控制的农产品流通体系建设研究,李先国,2011
1998,经济学,中国人民大学,规划基金项目,基于微观数据的我国居民税负分布测算及调整政策研究,谢波峰,2011
1999,经济学,中国药科大学,规划基金项目,我国基本药物可及性研究,徐伟,2011
2000,经济学,中国政法大学,规划基金项目,我国优势稀有金属类产品出口管制政策体系研究,张淑静,2011
2001,经济学,中国政法大学,规划基金项目,扩大就业战略背景下我国大学生就业质量问题研究,王霆,2011
2002,经济学,中国政法大学,规划基金项目,碳税、规模经济与重工业产业组织结构的调整：以钢铁业为,陈明生,2011
2003,经济学,中国政法大学,规划基金项目,增长主义发展模式及其转变研究,胡明,2011
2004,经济学,中国政法大学,规划基金项目,贸易救济措施重叠使用的政治经济学分析,宏结,2011
2005,经济学,中南财经政法大学,规划基金项目,金融市场时变联动与金融风险溢出的机制及实证研究,张金林,2011
2006,经济学,中南财经政法大学,规划基金项目,‘土地换保障’背景下失地农户的生计重建：基于可持续生计框架的分析,丁士军,2011
2007,经济学,中南财经政法大学,规划基金项目,基于生产关系依赖理论范式的马克思主义产权经济学研究,程启智,2011
2008,经济学,中南大学,规划基金项目,不同治理模式的产业集群在全球价值链治理结构演变中的角色研究,危平,2011
2009,经济学,中南大学,规划基金项目,基于TOPSIS的区域可持续发展能力综合评价研究,张颖,2011
2010,经济学,中南民族大学,规划基金项目,恩格斯在经济思想史中的地位,王志林,2011
2011,经济学,中山大学,规划基金项目,产权性质、R&D支出与公司价值,刘运国,2011
2012,经济学,中山大学,规划基金项目,背景风险与家庭金融投资行为研究,何兴强,2011
2013,经济学,中山大学,规划基金项目,我国制造业投入服务化的经济效应及地区差异研究——基于投入产出表的分析,李美云,2011
2014,经济学,中央财经大学,规划基金项目,人民币汇率的福利效应：理论与实证研究,黄昌利,2011
2015,经济学,重庆工商大学,规划基金项目,外国直接投资对中国产业集聚影响的区域差异及其门限效应,周兵,2011
2016,经济学,重庆工商大学,规划基金项目,空间极化与空间边化耦合作用下的区域边际化机制研究,王爱民,2011
2017,经济学,重庆交通大学,规划基金项目,装配式住宅体系在公租房建设中的应用研究,潘雨红,2011
2018,经济学,重庆理工大学,规划基金项目,教育投入和社会保障支出的联合机制及对城乡收入差距的影响效应研究,刘新,2011
2019,经济学,安徽财经大学,青年基金项目,基于经验定价核的不完全市场条件下期权定价研究,周海林,2011
2020,经济学,安徽财经大学,青年基金项目,国民收入分配对居民收入差距的影响研究,王力,2011
2021,经济学,安徽财经大学,青年基金项目,中远期现货电子交易市场价格操纵问题研究,韩刚,2011
2022,经济学,安徽大学,青年基金项目,我国承接国际外包的经济效应研究,徐毅,2011
2023,经济学,安徽工程大学,青年基金项目,区域承接产业转移及结构优化升级的机制和路径研究－以皖江城市带为例,廉同辉,2011
2024,经济学,安徽工业大学,青年基金项目,产业转移粘性与我国比较优势动态转化研究,成祖松,2011
2025,经济学,安徽建筑工业学院,青年基金项目,中国排污权初始分配、交易效率与区域补偿研究,王素凤,2011
2026,经济学,安阳师范学院,青年基金项目,基于全要素生产率视角的中国省际经济差距研究,石风光,2011
2027,经济学,北京大学,青年基金项目,中国农村“宗教热”发生与发展机制研究：精神合作社假说与代际传递模式,阮荣平,2011
2028,经济学,北京大学,青年基金项目,基于意愿的企业迁移决策行为及迁移引导政策研究,李彦军,2011
2029,经济学,北京大学,青年基金项目,农业土壤碳汇实现机制研究,刘奕,2011
2030,经济学,北京大学,青年基金项目,农村清洁发展机制项目益贫效应的评估——以世界银行社区发展碳基金沼气项目为,于敏,2011
2031,经济学,北京大学,青年基金项目,多纬贫困测量方法研究——以新疆生产建设兵团为例,张建伦,2011
2032,经济学,北京第二外国语学院,青年基金项目,高速铁路对旅游客流影响的区域差异研究,王欣,2011
2033,经济学,北京工商大学,青年基金项目,主观业绩评价及其制度效果——基于组织公正中介作用的路径研究,高晨,2011
2034,经济学,北京工商大学,青年基金项目,我国就业机会不平等与收入差距扩大的相互关系研究,徐秋慧,2011
2035,经济学,北京理工大学,青年基金项目,要素参与收入分配问题研究——收入分配中的劳动与资本,陈秀梅,2011
2036,经济学,北京理工大学,青年基金项目,后危机时期跨国流通企业买方市场势力及其反竞争效应研究,宋宪萍,2011
2037,经济学,北京联合大学,青年基金项目,流域保护政策有效性及其影响效应研究——以京津冀都市圈海河流域为例,郑海霞,2011
2038,经济学,北京林业大学,青年基金项目,我国城镇住宅市场泡沫测度研究,张宝林,2011
2039,经济学,北京师范大学,青年基金项目,盈余波动性成因及其市场反应研究,吕兆德,2011
2040,经济学,北京师范大学,青年基金项目,低碳经济视角下中国企业技术创新绩效研究,张江雪,2011
2041,经济学,长安大学,青年基金项目,构建收费公路行业可竞争性市场机制的政府规制研究,王婕妤,2011
2042,经济学,长春理工大学,青年基金项目,中国碳市场建设与碳定价权研究,张伟伟,2011
2043,经济学,长江大学,青年基金项目,国际服务外包对承接国就业的影响：理论、实证与中国的选,魏君英,2011
2044,经济学,长沙理工大学,青年基金项目,教育分配公平性对中国劳动力市场分割的影响研究,田晓青,2011
2045,经济学,常州大学,青年基金项目,不对称信息、市场参与者有限理性与股票波动性价值,张普,2011
2046,经济学,常州工学院,青年基金项目,加快生产性服务业发展推动产业转型升级的对策研究——以“长三角”为例,钱炳,2011
2047,经济学,大连理工大学,青年基金项目,以出口提升中国企业生产率―基于异质企业贸易理论的研究,刘海洋,2011
2048,经济学,大连理工大学,青年基金项目,基于纵向联盟的重大装备制造业升级路径及机制研究,任曙明,2011
2049,经济学,大连民族学院,青年基金项目,我国价格贸易条件冲击的动态传导机制：理论模型、数值模拟与计量分析,王亮,2011
2050,经济学,电子科技大学,青年基金项目,基于中国投资者的国际投资策略和投资利益研究,蒋崇辉,2011
2051,经济学,电子科技大学,青年基金项目,国际资本突然逆转与我国金融安全：成因分析及防范措施,尹宇明,2011
2052,经济学,东北财经大学,青年基金项目,高新技术产业技术创新效率的测度及其影响因素研究,刘伟,2011
2053,经济学,东北财经大学,青年基金项目,公共政策引导节能减排的理论与实证研究,许慧,2011
2054,经济学,东北财经大学,青年基金项目,经济开放、区域市场分割与居民消费过度敏感性差异：理论与实证,陈太明,2011
2055,经济学,东北财经大学,青年基金项目,银行与客户借贷关系中的非线性贷款定价研究,隋聪,2011
2056,经济学,东北财经大学,青年基金项目,“电荒”与煤-电价格传递的互动关系：理论模型与实证检,王建林,2011
2057,经济学,东北财经大学,青年基金项目,人口控制、质量替代与家庭人力资本投资：对中国转轨阶段教育发展的研究,谷宏伟,2011
2058,经济学,东北财经大学,青年基金项目,地缘社会网络信息传播与合作演化仿真研究,崔文杰,2011
2059,经济学,东北财经大学,青年基金项目,我国政府债务风险的评估与预警研究,王亚芬,2011
2060,经济学,东北大学,青年基金项目,国民幸福指数评价体系及应用研究-以河北省秦皇岛市为研,李刚,2011
2061,经济学,东北大学,青年基金项目,新农保试点对农户人力资本投资行为的影响研究:基于流动性约束视角,向涛,2011
2062,经济学,东北师范大学,青年基金项目,东北地区资源枯竭城镇的空间剥夺问题研究,王昱,2011
2063,经济学,东北师范大学,青年基金项目,教育公平视角下的公共教育支出优化研究,史桂芬,2011
2064,经济学,东北师范大学,青年基金项目,我国技术进步的偏向性及其收入分配效应研究,王林辉,2011
2065,经济学,东北师范大学,青年基金项目,均衡外汇管理框架下我国外汇储备的风险、收益研究,王立荣,2011
2066,经济学,东华大学,青年基金项目,风险投资的空间行为及对我国的空间塑造研究,袁新敏,2011
2067,经济学,东华大学,青年基金项目,基于银保协作路径的商业银行信用风险识别与预警机制研究,顾海峰,2011
2068,经济学,东华理工大学,青年基金项目,促进我国清洁能源产业发展的财税政策研究,马杰,2011
2069,经济学,东南大学,青年基金项目,基于全球生产网络视角的地区专业化演化与区域协调发展研,陈健,2011
2070,经济学,东南大学,青年基金项目,依托产业集群演进的我国制造业中小企业自组织成长机制研,赵驰,2011
2071,经济学,东南大学,青年基金项目,基于网络经济的产业结构优化机制及其实现路径研究,高彦彦,2011
2072,经济学,对外经济贸易大学,青年基金项目,构建知识产权制度与自主创新效应研究-基于日本的经验与,赵旭梅,2011
2073,经济学,对外经济贸易大学,青年基金项目,不完全信息、激励契约与中国资产管理业组织形式演进研究,肖欣荣,2011
2074,经济学,对外经济贸易大学,青年基金项目,促进消费视角下的政府支出选择,李晓嘉,2011
2075,经济学,对外经济贸易大学,青年基金项目,中国对外贸易隐含碳与减排政策研究：基于MRIO模型的评估,闫云凤,2011
2076,经济学,对外经济贸易大学,青年基金项目,产业转移、再集聚与区域协调发展研究,邓慧慧,2011
2077,经济学,对外经济贸易大学,青年基金项目,企业风险管理的传导路径：理论与实证研究,王东,2011
2078,经济学,佛山科学技术学院,青年基金项目,新型农村社会养老保险制度的福利效应及政府补贴模式优化,黄丽,2011
2079,经济学,福州大学,青年基金项目,基于SID视角的新型农村合作医疗制度研究：福利分析与政,宁满秀,2011
2080,经济学,复旦大学,青年基金项目,上市公司并购绩效的社会净效应研究：度量方法与评价体系,刘尚鑫,2011
2081,经济学,复旦大学,青年基金项目,改革开放以来中国居民幸福感的变化规律及影响因素研究——兼论收入对幸福的影,娄伶俐,2011
2082,经济学,复旦大学,青年基金项目,促进低收入群体收入稳定增长的财政转移支付机制研究,余显财,2011
2083,经济学,复旦大学,青年基金项目,信息披露对高管隐形激励和企业创新能力的影响：理论与实证研究,齐倩茹,2011
2084,经济学,复旦大学,青年基金项目,经理人股权性激励、风险性创新和动态产品市场竞争,常中阳,2011
2085,经济学,广东工业大学,青年基金项目,产业层面的知识扩散与产业空间战略研究,邓晓锋,2011
2086,经济学,广东工业大学,青年基金项目,收入分配演进对需求驱动型技术创新的影响机制研究,李景睿,2011
2087,经济学,广东金融学院,青年基金项目,区域产业转型与区域产业品牌效应研究,祝佳,2011
2088,经济学,广东金融学院,青年基金项目,上市公司债券融资需求、工具选择和监管机制设计研究,李湛,2011
2089,经济学,广东商学院,青年基金项目,声誉机制、会计信息质量与投资者保护研究,雷宇,2011
2090,经济学,广东商学院,青年基金项目,中国会计准则国际趋同的经济后果研究,刘晓华,2011
2091,经济学,广东商学院,青年基金项目,基于产业和空间二维互动的物流业与制造业双重集聚研究,韦琦,2011
2092,经济学,广东外语外贸大学,青年基金项目,通胀预期下我国货币政策的经济结构调整效应研究,展凯,2011
2093,经济学,广东外语外贸大学,青年基金项目,制度因素作用于区域经济增长：基于企业一体化决策的视角,刘红娟,2011
2094,经济学,广东外语外贸大学,青年基金项目,中国货币政策结构性非对称效应与经济结构调整——基于非线性模型的研究,张淑娟,2011
2095,经济学,广东外语外贸大学,青年基金项目,服务外包与区域创新的互动机制研究-基于自组织理论的视,崔萍,2011
2096,经济学,广西财经学院,青年基金项目,开发性金融视角的西部地区地方政府投融资平台发展研究,刘金林,2011
2097,经济学,广西财经学院,青年基金项目,西江流域开发与低碳产业体系构建研究,谭建新,2011
2098,经济学,贵州财经学院,青年基金项目,贵州少数民族地区信用票据研究,王敏,2011
2099,经济学,贵州财经学院,青年基金项目,中国旅游业管理制度变迁机制及理论体系研究——基于新博弈格局视角,杨春宇,2011
2100,经济学,贵州大学,青年基金项目,水利设施建设与旅游空间结构演化及调适机制研究——以贵州省为例,笪玲,2011
2101,经济学,哈尔滨工程大学,青年基金项目,公平条件下基于责能指数的初始碳排放权分配研究,于雪霞,2011
2102,经济学,哈尔滨理工大学,青年基金项目,基于自愿标签制度的中国乳制品质量安全监管模式创新研究,王威,2011
2103,经济学,哈尔滨商业大学,青年基金项目,我国政府资产负债表的功能回归与模式创新,景宏军,2011
2104,经济学,哈尔滨商业大学,青年基金项目,东北地区制造业与物流业联动机理及模式创新研究,赵英霞,2011
2105,经济学,哈尔滨商业大学,青年基金项目,社会转型期我国食品安全规制创新研究：一个网络治理框架的构建,滕月,2011
2106,经济学,海南大学,青年基金项目,基于选择价值的农地城市流转决策分析—以海口市城乡结合部为例,王湃,2011
2107,经济学,杭州电子科技大学,青年基金项目,基于品牌群落演化的产业集群可持续发展理论模型与实证研,郑佳,2011
2108,经济学,杭州师范大学,青年基金项目,制度性贫困与包容性增长减贫模式研究——基于百强县和贫困县的调查,杨丹妮,2011
2109,经济学,合肥工业大学,青年基金项目,农民专业合作社股权结构对合作社功能的影响研究,崔宝玉,2011
2110,经济学,合肥工业大学,青年基金项目,全球价值链中学习效应的理论与实证研究——基于中国本土企业的视角,孙红燕,2011
2111,经济学,河北师范大学,青年基金项目,中国体育产业竞争力问题研究,刘希佳,2011
2112,经济学,河海大学,青年基金项目,我国审计师法律惩戒后果的实证研究——以行政处罚为重点,刘笑霞,2011
2113,经济学,河南财经政法大学,青年基金项目,非平稳时间序列分析中跨时加总和系统抽样问题研究,叶光,2011
2114,经济学,河南财经政法大学,青年基金项目,股票市场透明度对市场质量影响的研究,张肖飞,2011
2115,经济学,河南大学,青年基金项目,企业异质性、空间集聚与区域经济差异研究——基于TFP动态演化的视角,李颖,2011
2116,经济学,河南大学,青年基金项目,基于农户行为的农业环境政策创新研究,梁流涛,2011
2117,经济学,河南大学,青年基金项目,极端风险条件下投资组合保险策略研究,姚远,2011
2118,经济学,河南大学,青年基金项目,我国资本市场定向增发融资工具的优化研究,郑祖玄,2011
2119,经济学,河南理工大学,青年基金项目,粮食主产区耕地保护外部性量化研究：理论模型与实证分析,牛海鹏,2011
2120,经济学,河南理工大学,青年基金项目,环境管制视角下的企业竞争力提升策略与政策模拟,李创,2011
2121,经济学,河南师范大学,青年基金项目,下滑风险度量下企业年金基金的投资管理问题研究,翟永会,2011
2122,经济学,河南师范大学,青年基金项目,人口老龄化趋势下的退休年龄调整、人力资本积累与养老储蓄决策,康建英,2011
2123,经济学,河南师范大学,青年基金项目,城乡基本公共服务均等化的目标选择、实现路径与动态评价,乔俊峰,2011
