序号,学科门类,学校名称,项目类别,项目名称,申请人,年份
1001,交叉学科/综合研,长春大学,规划基金项目,基于联合国框架下国际热点问题的中西方政治讲话语篇对比,王金玲,2011
1002,交叉学科/综合研,巢湖学院,规划基金项目,明清时期皖江流域水资源环境与农田水利建设,陈恩虎,2011
1003,交叉学科/综合研,成都理工大学,规划基金项目,中国二氧化碳捕捉与封存（CCS）早期实施方案构建及评价,匡建超,2011
1004,交叉学科/综合研,大连理工大学,规划基金项目,神经信息学视阈下的大学生压力认知与应对研究,马莹华,2011
1005,交叉学科/综合研,大连理工大学,规划基金项目,中国人汉、英关系从句的认知神经机制研究,王慧莉,2011
1006,交叉学科/综合研,东北大学,规划基金项目,唐代官员考核机制与任职评价研究——以行政法史为视角,董劭伟,2011
1007,交叉学科/综合研究,东北师范大学,规划基金项目,职业群体公民行为推进中小企业低碳社会责任策略研究——基于东北地区的实证研,张凤荣,2011
1008,交叉学科/综合研,东南大学,规划基金项目,青少年抑郁、焦虑与头发皮质醇的关联研究,邓慧华,2011
1009,交叉学科/综合研,对外经济贸易大学,规划基金项目,北非政局动荡对我国投资该地区及非洲的影响与对策研究,杨国亮,2011
1010,交叉学科/综合研,福建农林大学,规划基金项目,集体所有的生态公益林生态补偿标准计量研究——以福建省,陈钦,2011
1011,交叉学科/综合研,福建师范大学,规划基金项目,褐色土地再利用：障碍、冲突与协调机制,谢红彬,2011
1012,交叉学科/综合研,复旦大学,规划基金项目,大学研究中心的组际网络与人际网络研究,刘凡丰,2011
1013,交叉学科/综合研究,赣南师范学院,规划基金项目,城镇化进程中农民工认同困境对消费行为影响研究——以客家农民工为例,黄侦,2011
1014,交叉学科/综合研究,广东商学院,规划基金项目,气候变化下国际贸易新型环境壁垒的贸易福利效应及我国对策研究,黄晓凤,2011
1015,交叉学科/综合研究,广东外语外贸大学,规划基金项目,思想与社会转型期文学嬗变考--中日近代文学起源比较研究,刘金举,2011
1016,交叉学科/综合研,广东外语外贸大学,规划基金项目,基于语言知识库的英汉双向口译训练系统的研制,马立东,2011
1017,交叉学科/综合研究,广西大学,规划基金项目,技术进步、制度变迁与创业机会：基于欠发达地区的理论与实证研究,毕先萍,2011
1018,交叉学科/综合研,广西大学,规划基金项目,社会化标签系统用户偏好挖掘与电子商务个性化服务的研究,覃华,2011
1019,交叉学科/综合研,广州大学,规划基金项目,珠三角物流企业空间集聚特征及配送模型研究,陈颖彪,2011
1020,交叉学科/综合研究,广州大学,规划基金项目,改变语言改变认知吗？-语言表征对认知心理水平的模式识别与干预研究,徐芃,2011
1021,交叉学科/综合研究,贵州财经学院,规划基金项目,黔滇交界地区社会文化及心理因素对少数民族流动人口艾滋病高危性行为的影响,胡健,2011
1022,交叉学科/综合研究,贵州大学,规划基金项目,西南喀斯特山地省区生态脆弱性引致的农村返贫问题研究—以贵州为例,汪磊,2011
1023,交叉学科/综合研,桂林电子科技大学,规划基金项目,不依赖主题的大学英语作文自动评分技术研究,周娅,2011
1024,交叉学科/综合研,哈尔滨师范大学,规划基金项目,黑龙江省文化产业学科群建设的理论与实践,王伟建,2011
1025,交叉学科/综合研,合肥工业大学,规划基金项目,城市景观的文化价值与地域特色研究,陈刚,2011
1026,交叉学科/综合研,河南大学,规划基金项目,东周郑韩陶文研究,黄锦前,2011
1027,交叉学科/综合研,河南大学,规划基金项目,洛阳商周有铭青铜器整理研究,张新俊,2011
1028,交叉学科/综合研,贺州学院,规划基金项目,民间信仰与明清话本小说神异叙事研究,杨宗红,2011
1029,交叉学科/综合研,湖北经济学院,规划基金项目,国际公共产品供给问题研究,李新,2011
1030,交叉学科/综合研,湖南大学,规划基金项目,转变经济发展方式背景下加快我国文化产业发展对策研究,向志强,2011
1031,交叉学科/综合研,湖南大学,规划基金项目,有时滞影响的双币种期权定价及风险管理研究,李亚琼,2011
1032,交叉学科/综合研,湖南科技大学,规划基金项目,经济系统与生态系统耦合的农业职业需求问题研究,晏小敏,2011
1033,交叉学科/综合研,湖南科技大学,规划基金项目,后哥本哈根时代我国出口产品碳足迹的量化评估与标注研究,赵立华,2011
1034,交叉学科/综合研究,湖南理工学院,规划基金项目,惩治民族恐怖主义犯罪刑事政策与民族地方社会稳定关系问题研究,喻义东,2011
1035,交叉学科/综合研,湖南商学院,规划基金项目,基于在线小波支持向量机的金融高频波动率建模研究,汤凌冰,2011
1036,交叉学科/综合研,湖南商学院,规划基金项目,基于MAS计算的复杂供应链动态协作信任机制与方法研究,蒋伟进,2011
1037,交叉学科/综合研,湖州师范学院,规划基金项目,唐代乐舞歌辞研究,周期政,2011
1038,交叉学科/综合研,华北电力大学,规划基金项目,我国碳排放时空演变机制及减排政策分析,张兴平,2011
1039,交叉学科/综合研,华东师范大学,规划基金项目,儿童早期数学学习困难的诊断与干预研究,周欣,2011
1040,交叉学科/综合研究,华东师范大学,规划基金项目,少数民族的都市迁移研究：以上海为例,王富文NicholasTapp,2011
1041,交叉学科/综合研,华东师范大学,规划基金项目,罗伯聃、马儒翰、郭士立、威妥玛等的在华汉语活动研究,王幼敏,2011
1042,交叉学科/综合研,华东政法大学,规划基金项目,狄更斯的法律世界,孙达丹,2011
1043,交叉学科/综合研,华南农业大学,规划基金项目,农民增收的多功能农业结构优化研究,陈建国,2011
1044,交叉学科/综合研,华南师范大学,规划基金项目,商周金文中的军事资料整理与疏证,商艳涛,2011
1045,交叉学科/综合研,华南师范大学,规划基金项目,国际旅游岛开发背景下海南世居少数民族边缘化研究,刘俊,2011
1046,交叉学科/综合研,华中师范大学,规划基金项目,中国古代小说图像的语义研究,金聪,2011
1047,交叉学科/综合研,怀化学院,规划基金项目,民营加工贸易企业转型升级中的风险管理研究,常立华,2011
1048,交叉学科/综合研究,黄淮学院,规划基金项目,历史军事文化景观的理论与实践研究—以关公等传统民族军事文化景观为例,袁运福,2011
1049,交叉学科/综合研,吉林大学,规划基金项目,高维计量经济模型的变量选择及其应用,赵世舜,2011
1050,交叉学科/综合研,集美大学,规划基金项目,闽南摩崖石刻与两岸文化交流研究,陈光田,2011
1051,交叉学科/综合研,集美大学,规划基金项目,海峡两岸高校“预就业”人才培养模式比较研究,刘子奋,2011
1052,交叉学科/综合研究,暨南大学,规划基金项目,现代分销批发组织的生成与新兴中间流通商培育的理论与实证研究,陈海权,2011
1053,交叉学科/综合研,暨南大学,规划基金项目,基于进化图理论和最优化理论的企业组织结构综合分析,张培爱,2011
1054,交叉学科/综合研,嘉应学院,规划基金项目,新时期中国县制改革与县域经济科学发展的适应性研究,闫恩虎,2011
1055,交叉学科/综合研,江南大学,规划基金项目,区域性碳交易平台的系统研究,唐建荣,2011
1056,交叉学科/综合研,江南大学,规划基金项目,web2.0背景下的新兴文化创意产业研究,吴祐昕,2011
1057,交叉学科/综合研,江南大学,规划基金项目,地方精英与社会管理——基于民国时期无锡城区的分析,汪春劼,2011
1058,交叉学科/综合研,江西财经大学,规划基金项目,马克思经济学的方法论思想与发展方向,罗雄飞,2011
1059,交叉学科/综合研,江西农业大学,规划基金项目,后税费时代乡村“权力文化网络”的选择与发展研究,傅琼,2011
1060,交叉学科/综合研,兰州交通大学,规划基金项目,物联网环境下西部地区虚拟应急物流网络体系及运作机制研,朱昌锋,2011
1061,交叉学科/综合研,闽江学院,规划基金项目,审美现代性的后现代实践：以批判美学、先锋派为考察中心,陈开晟,2011
1062,交叉学科/综合研,内蒙古科技大学,规划基金项目,可持续发展能源需求系统建模研究,宋宇辰,2011
1063,交叉学科/综合研,南京财经大学,规划基金项目,基于粮食安全的我国粮食行业结构优化研究,侯立军,2011
1064,交叉学科/综合研,南京师范大学,规划基金项目,我国立法文本语言失范化问题及其对策研究,董晓波,2011
1065,交叉学科/综合研,南京师范大学,规划基金项目,包容性增长下居民收入提升路径研究,顾建平,2011
1066,交叉学科/综合研,南通大学,规划基金项目,社会转型期艺术人格的构建与培养研究,李建东,2011
1067,交叉学科/综合研,青岛科技大学,规划基金项目,基于公共政策视角的节能减排政策评价与政策优化研究,邱立新,2011
1068,交叉学科/综合研,三峡大学,规划基金项目,最近30年人类学英文论著汉译质量分析,谢国先,2011
1069,交叉学科/综合研,山东财政学院,规划基金项目,我国加工贸易由沿海向中西部梯度转移的产业集聚研究,王培志,2011
1070,交叉学科/综合研,山东大学,规划基金项目,人力资本利用效率与我国区域经济均衡发展研究,张文玺,2011
1071,交叉学科/综合研,山东科技大学,规划基金项目,构建政府资助下租赁为主体的城镇住房保障模式研究,李英,2011
1072,交叉学科/综合研,山西师范大学,规划基金项目,中国神庙剧场史,曹飞,2011
1073,交叉学科/综合研,山西中医学院,规划基金项目,宋代文士通医现象研究,薛芳芸,2011
1074,交叉学科/综合研,上海财经大学,规划基金项目,疾病风险全保障的筹与政府财政能力研究,李华,2011
1075,交叉学科/综合研究,上海师范大学,规划基金项目,社会福利最大化约束下我国彩票销量的合意规模测度及其实现的研究,李刚,2011
1076,交叉学科/综合研,上海体育学院,规划基金项目,镜像中国：BBC关于中国报道的实证研究（2001-2010）,陈丽江,2011
1077,交叉学科/综合研,韶关学院,规划基金项目,建国以来中国城市公共文化空间的变迁研究,仲红卫,2011
1078,交叉学科/综合研究,深圳大学,规划基金项目,建设项目利益相关者的建筑废弃物减量化行为机理及导向机制研究,李景茹,2011
1079,交叉学科/综合研,沈阳师范大学,规划基金项目,东北少数民族文学传播研究,曹萌,2011
1080,交叉学科/综合研,石家庄铁道大学,规划基金项目,高速铁路环境影响评价理论与方法研究,张小平,2011
1081,交叉学科/综合研,首都师范大学,规划基金项目,逻辑思维能力与创新型人才培养研究,冯艳,2011
1082,交叉学科/综合研,首都医科大学,规划基金项目,新医改背景下生命临终关怀机构建设标准的研究,李义庭,2011
1083,交叉学科/综合研究,四川师范大学,规划基金项目,文化边疆建设与边疆教育转型——1935-1949年西部边疆师范教育研究,凌兴珍,2011
1084,交叉学科/综合研,苏州大学,规划基金项目,适应与生存——中国古代月令思想研究,胡火金,2011
1085,交叉学科/综合研,苏州科技学院,规划基金项目,昆曲非物质文化遗产影像数据库系统建设,邵斌,2011
1086,交叉学科/综合研究,台州职业技术学院,规划基金项目,公民政策参与背景下地方政府民意吸纳与回应机制研究——以浙江实践为例,吴太胜,2011
1087,交叉学科/综合研,天津大学,规划基金项目,学科建设提升我国高校核心竞争力的研究,肖凤翔,2011
1088,交叉学科/综合研,天津理工大学,规划基金项目,基于可持续开发理论的纤维素乙醇开发策略研究,冯炘,2011
1089,交叉学科/综合研,天津体育学院,规划基金项目,我国青少年体质健康促进模型的构建及实证追踪研究,谭思洁,2011
1090,交叉学科/综合研,温州医学院,规划基金项目,老年人家庭健康教育内容、方法及质量评价指标体系的研究,尹志勤,2011
1091,交叉学科/综合研,武汉大学,规划基金项目,经济发展模式转型背景下消费需求合理性的交叉科学研究,王今朝,2011
1092,交叉学科/综合研,武汉工程大学,规划基金项目,近代中国都市苦力研究-以沪、宁、汉、渝为中心,刘秋阳,2011
1093,交叉学科/综合研,武汉科技大学,规划基金项目,应对突发公共卫生事件的灾害护理教育及救援网络构建的研,余桂林,2011
1094,交叉学科/综合研究,武汉理工大学,规划基金项目,工业设计课程体系中“审美情感”与“技术原理”关系的系统构架研究,汤军,2011
1095,交叉学科/综合研,西安理工大学,规划基金项目,嵌入情绪因素的网络群体性事件的博弈模型和舆情传导机制,熊国强,2011
1096,交叉学科/综合研,西安欧亚学院,规划基金项目,中国风水与现代环境艺术设计,胡义成,2011
1097,交叉学科/综合研,西北工业大学,规划基金项目,博洛尼亚进程的瑞典大学教育新思维发展模式,赵硕,2011
1098,交叉学科/综合研,西北民族大学,规划基金项目,藏族历算中的汉藏文化交流研究,夏吾才,2011
1099,交叉学科/综合研,西北民族大学,规划基金项目,藏文网络舆情传播与主体行为研究,李应兴,2011
1100,交叉学科/综合研究,西藏大学,规划基金项目,少数民族生产生活方式与西藏生态安全屏障建设研究——以墨脱县为例,郭光普,2011
1101,交叉学科/综合研,西南交通大学,规划基金项目,基于群体智能涌现的网络舆情突发事件预警机制研究,杨燕,2011
1102,交叉学科/综合研,西南科技大学,规划基金项目,中国西方哲学经典著作翻译史,高阳,2011
1103,交叉学科/综合研,厦门大学,规划基金项目,当前中东国家的政治动荡及其对我国的影响,范鸿达,2011
1104,交叉学科/综合研究,咸宁学院,规划基金项目,农地边际化对农户土地利用行为的影响及其粮食生产效应研究——以江汉平原为例,黄利民,2011
1105,交叉学科/综合研,延边大学,规划基金项目,基于动态电子腭位的汉语普通话语音研究,李英浩,2011
1106,交叉学科/综合研,扬州大学,规划基金项目,清代《左传》考证研究,金永健,2011
1107,交叉学科/综合研,宜春学院,规划基金项目,第二代农民工市民化的天花板效应分析及对策研究,李菊花,2011
1108,交叉学科/综合研,云南艺术学院,规划基金项目,云南少数民族影视资源的产业化开发,王智,2011
1109,交叉学科/综合研究,浙江财经学院,规划基金项目,环杭州湾农户行为对土地利用的影响机理及其调控机制研究——MAS模拟与景观分,祁黄雄,2011
1110,交叉学科/综合研,浙江传媒学院,规划基金项目,基于电视和网络的准社会交往实证研究,葛进平,2011
1111,交叉学科/综合研,浙江大学,规划基金项目,网络暴力和网络色情的传播机制与整治策略研究,李岩,2011
1112,交叉学科/综合研,浙江大学城市学院,规划基金项目,信息视角下非物质文化遗产的数字化生存研究,杨程,2011
1113,交叉学科/综合研究,浙江工商大学,规划基金项目,基于游客感知的主题公园品牌转换行为--长三角主题公园实证研究,程乾,2011
1114,交叉学科/综合研,浙江金融职业学院,规划基金项目,中国古代诗人地理信息系统研究——以唐朝为案例,赵志强,2011
1115,交叉学科/综合研,浙江理工大学,规划基金项目,土地非农化过程中村干部行为模式及制度逻辑研究,扈映,2011
1116,交叉学科/综合研,浙江农林大学,规划基金项目,面向碳交易市场的森林经营决策机制与仿真研究,龙飞,2011
1117,交叉学科/综合研,浙江万里学院,规划基金项目,网络流行语对青少年学生价值观的影响研究,陈万怀,2011
1118,交叉学科/综合研,中国传媒大学,规划基金项目,中国电影产业理论构架及其应用,蒲剑,2011
1119,交叉学科/综合研,中国地质大学,规划基金项目,信息生态背景下拔尖创新人才信息素养培养研究,别雪君,2011
1120,交叉学科/综合研究,中国科学技术大学,规划基金项目,健康传播对健康素养的实证研究和比较分析——以大陆直辖市和台北市为例,秦美婷,2011
1121,交叉学科/综合研,中国矿业大学,规划基金项目,煤炭企业绿色开采驱动系统构建及调控机制设计,王林秀,2011
1122,交叉学科/综合研,中国人民公安大学,规划基金项目,当前中国个人极端暴力杀人犯罪个案研究,靳高风,2011
1123,交叉学科/综合研,中国政法大学,规划基金项目,传闻证据规则的语言学研究,邹玉华,2011
1124,交叉学科/综合研,中南财经政法大学,规划基金项目,网络伪舆情的甄别与防范机制研究,刘勘,2011
1125,交叉学科/综合研究,中南民族大学,规划基金项目,经济发展方式转变对教育需求的实证分析-基于经济普查和人口普查的统计研究,段敏芳,2011
1126,交叉学科/综合研,中山大学,规划基金项目,法律解决钓鱼岛问题的可行性与必要性研究,张祖兴,2011
1127,交叉学科/综合研,中央财经大学,规划基金项目,投资者情绪、定向增发价格折扣与发行机制研究,徐斌,2011
1128,交叉学科/综合研究,中央民族大学,规划基金项目,社区心理学视角下边疆社会资本增进途径研究:民族旅游社区为例,李燕琴,2011
1129,交叉学科/综合研,仲恺农业工程学院,规划基金项目,异化的农民合作社及其组织治理研究,吴晨,2011
1130,交叉学科/综合研,重庆大学,规划基金项目,现代大学基层学术组织的治理模式研究,蔡珍红,2011
1131,交叉学科/综合研,重庆大学,规划基金项目,统筹城乡发展农民工进城就业安居制度保障创新研究,陈其安,2011
1132,交叉学科/综合研,重庆工商大学,规划基金项目,我国封闭式小区的治理与住房隔离,邓锋,2011
1133,交叉学科/综合研,重庆师范大学,规划基金项目,三峡库区乡村聚落演变与空间优化研究,李孝坤,2011
1134,交叉学科/综合研究,安徽财经大学,青年基金项目,旅游真实性感知形成机理及其与游客态度和行为的关系——以古村落为例,徐伟,2011
1135,交叉学科/综合研,安徽农业大学,青年基金项目,科技工作者科学创造活动中的审美意象作用过程研究,滕瀚,2011
1136,交叉学科/综合研,北方工业大学,青年基金项目,大众消费文化场景下的中国建筑形式创作研究,王又佳,2011
1137,交叉学科/综合研究,北京大学,青年基金项目,基于多水平模型的农村人群心脑血管疾病及其社会决定因素的聚集性研究,唐迅,2011
1138,交叉学科/综合研究,北京工商大学,青年基金项目,关系网络扩展与农业交易治理机制创新：湘鄂三县葡萄种植业的比较案例研究,徐振宇,2011
1139,交叉学科/综合研,北京工商大学,青年基金项目,网络隐私权的侵权问题与法律保护研究,路鹃,2011
1140,交叉学科/综合研,北京工商大学,青年基金项目,中国对外政策中的国内舆论引导机制研究,余金城,2011
1141,交叉学科/综合研,北京航空航天大学,青年基金项目,面向丝绸等各向异性材质的真实感建模技术研究,胡勇,2011
1142,交叉学科/综合研,北京化工大学,青年基金项目,基于申请量预测的我国化工行业专利预警研究,蔡中华,2011
1143,交叉学科/综合研,北京交通大学,青年基金项目,中国新能源汽车产业联盟绩效影响因素研究,刘颖琦,2011
1144,交叉学科/综合研究,北京联合大学,青年基金项目,和谐社会建设时期群体性劳资冲突事件的演化及其应对体系构建研究,何勤,2011
1145,交叉学科/综合研,北京林业大学,青年基金项目,农村政策性小额林权抵押贷款模式研究,周莉,2011
1146,交叉学科/综合研,北京师范大学,青年基金项目,数字谚语民俗地图研究,赖彦斌,2011
1147,交叉学科/综合研究,北京中医药大学,青年基金项目,国际化背景下中医药专业的英语教学现状调查与对策研究—以京、鄂、滇中医高等,胡丽萍,2011
1148,交叉学科/综合研,北京中医药大学,青年基金项目,基于企业边界理论的医药分开研究,武锋,2011
1149,交叉学科/综合研,昌吉学院,青年基金项目,多重文化语境中天山北坡公众审美与家庭视觉文化的调查研,邬建华,2011
1150,交叉学科/综合研,长春中医药大学,青年基金项目,循证医学视域下推拿学科发展的挑战和对策研究,郑伟峰,2011
1151,交叉学科/综合研究,长沙理工大学,青年基金项目,风景名胜区生态旅游承载力理论及实证研究——以武陵源景区为例,熊鹰,2011
1152,交叉学科/综合研,长沙学院,青年基金项目,中国精神卫生资源配置的空间经济学研究,陈艳,2011
1153,交叉学科/综合研,常州大学,青年基金项目,基于降雨量指数保险的农业干旱风险控制与模拟研究,马剑锋,2011
1154,交叉学科/综合研,常州工学院,青年基金项目,面向商务智能的商业银行移动商务消费者信息挖掘与应用研,曹国,2011
1155,交叉学科/综合研,常州信息职业技术学,青年基金项目,城市社区管理中的多元共商机制研究,骆建建,2011
1156,交叉学科/综合研究,成都理工大学,青年基金项目,重大自然灾害后学校体育重建理论与实践研究——以汶川地震灾区为例,张晓林,2011
1157,交叉学科/综合研,成都体育学院,青年基金项目,中国民间武术研究——以四川地区民间武术为例,龚茂富,2011
1158,交叉学科/综合研究,成都中医药大学,青年基金项目,基于法定药品质量标准的藏医学-印度阿育吠陀医学知识的数据挖掘和对比研究,王张,2011
1159,交叉学科/综合研,大连理工大学,青年基金项目,绿色交通信号控制研究,章立辉,2011
1160,交叉学科/综合研,大连民族学院,青年基金项目,基于PGIS的社区灾害风险管理模式研究,张振国,2011
1161,交叉学科/综合研,大连外国语学院,青年基金项目,认知语用文体学的理论构建与实践,刘风光,2011
1162,交叉学科/综合研,大连外国语学院,青年基金项目,基于多层面特征分析的在线信息作者身份识别方法研究,祁瑞华,2011
1163,交叉学科/综合研,德州学院,青年基金项目,基于时间序列分析的我国食品安全预警分析系统研究,吕志轩,2011
1164,交叉学科/综合研,电子科技大学,青年基金项目,现代生物技术企业的知识产权策略研究:基于技术创新的视,冯薇,2011
1165,交叉学科/综合研,东北财经大学,青年基金项目,经营者集中反垄断审查中的经济证据研究,吴绪亮,2011
1166,交叉学科/综合研究,东北财经大学,青年基金项目,任免机制、独立性与竞争：我国独立董事监督机制设计的实验研究,高玥,2011
1167,交叉学科/综合研,东北大学,青年基金项目,农民工消费行为及城乡消费联动机制研究,刘金星,2011
1168,交叉学科/综合研,东北师范大学,青年基金项目,基于语义化标注的网络学习资源组织方法及实证研究,魏来,2011
1169,交叉学科/综合研,东华大学,青年基金项目,技术化生存与私人生活空间——高技术应用对隐私影响的研,王治东,2011
1170,交叉学科/综合研究,东南大学,青年基金项目,农民工随迁子女的身份认同、同伴效应与义务教育均等化：基于行为实验的研究,何玉梅,2011
1171,交叉学科/综合研,东南大学,青年基金项目,中国近代建筑师职业制度研究,汪晓茜,2011
1172,交叉学科/综合研,东南大学,青年基金项目,基于4PL的化工产品逆向物流整合模式研究,任丽丽,2011
1173,交叉学科/综合研,对外经济贸易大学,青年基金项目,同声传译认知加工能力研究,高彬,2011
1174,交叉学科/综合研,对外经济贸易大学,青年基金项目,不确定环境下基于网络结构的社会网络监控决策优化研究,倪耀东,2011
1175,交叉学科/综合研,福州大学,青年基金项目,审美认知加工模型构建,陈丽君,2011
1176,交叉学科/综合研,阜阳师范学院,青年基金项目,基于词性标注的现代汉语兼语式自动识别研究,傅成宏,2011
1177,交叉学科/综合研,复旦大学,青年基金项目,我国人口发展对碳排放影响的系统仿真与情景分析,朱勤,2011
1178,交叉学科/综合研,甘肃民族师范学院,青年基金项目,“花儿”与西北多民族聚居区社会秩序研究,王晓云,2011
1179,交叉学科/综合研,赣南师范学院,青年基金项目,风险控制视角下的内部审计职能拓展及其路径研究,郭慧,2011
