序号,学科门类,学校名称,项目类别,项目名称,申请人,年份
1,法学,安徽大学,规划基金项目,回应型监督理论与监督机制研究：以县委权力为例,杨成炬,2011
2,法学,安徽大学,规划基金项目,我国危害食品安全犯罪体系研究,陈结淼,2011
3,法学,安徽工业大学,规划基金项目,企业慈善捐赠法律保障机制研究,戚枝淬,2011
4,法学,安徽工业大学,规划基金项目,节能减排背景下政府环境责任实现机制研究,邓可祝,2011
5,法学,北京大学,规划基金项目,我国原子能立法研究,唐应茂,2011
6,法学,北京大学,规划基金项目,国际视野中的我国反洗钱立法与完善,王新,2011
7,法学,北京工商大学,规划基金项目,体育知识产权保护问题研究,徐康平,2011
8,法学,北京工业大学,规划基金项目,内幕交易监管的困境及其对策研究,聂孝红,2011
9,法学,北京工业大学,规划基金项目,后金融危机时代中国制造业产业升级的知识产权战略研究,靳晓东,2011
10,法学,北京师范大学,规划基金项目,事业单位改革中法人治理结构及其法律调控模式研究,夏利民,2011
11,法学,北京外国语大学,规划基金项目,社会转型期的群体性暴力事件与“仇恨犯罪”治理控制研究,王文华,2011
12,法学,长安大学,规划基金项目,西北地区能源开发生态保护长效机制研究,刘志,2011
13,法学,东北财经大学,规划基金项目,符合GPA要求的政府采购救济机制构建研究,张幸临,2011
14,法学,东北林业大学,规划基金项目,非公有制林业管理法律制度体系研究,包玉华,2011
15,法学,对外经济贸易大学,规划基金项目,中国发展低碳金融的法律保障体系研究,丁丁,2011
16,法学,对外经济贸易大学,规划基金项目,我国证券市场国际板设立中法律问题研究,马其家,2011
17,法学,广东金融学院,规划基金项目,知识产权交叉案件合一审判模式的司法公信力研究,安雪梅,2011
18,法学,广东外语外贸大学,规划基金项目,电子化行政行为及其法律规制研究,杨桦,2011
19,法学,广西师范大学,规划基金项目,RTA协定中投资机制研究——兼论以FTA中的投资规则保护中国海外投资,杨丽艳,2011
20,法学,贵州师范大学,规划基金项目,民族区域自治权的虚置及其对策研究——基于黔东南苗族侗族自治州的实证分析,杨贵生,2011
21,法学,哈尔滨工业大学,规划基金项目,一个中国原则下两岸关系和平发展中的法律问题研究,葛勇平,2011
22,法学,哈尔滨商业大学,规划基金项目,涉及公众人物侵权问题研究,王福友,2011
23,法学,海南大学,规划基金项目,我国民法典中私权一体化与三元结构的立法设计,李建华,2011
24,法学,海南大学,规划基金项目,南海油气资源开发法律问题研究,张丽娜,2011
25,法学,海南大学,规划基金项目,海南国际旅游岛建设所涉知识产权培育、保护和利用问题研,刘远山,2011
26,法学,河南财经政法大学,规划基金项目,清末民初习惯法与国家法的关系探析——立足于社会控制的,马珺,2011
27,法学,黑龙江大学,规划基金项目,我国票据法修改方案的设计及其立法理由,董惠江,2011
28,法学,黑龙江大学,规划基金项目,俄罗斯法治进程中的文化影响力研究,杨昌宇,2011
29,法学,黑龙江大学,规划基金项目,生态保护与物权配置研究,陈文,2011
30,法学,湖南大学,规划基金项目,消费者保护中的冷却期制度研究,张靖,2011
31,法学,湖南警察学院,规划基金项目,虚拟社会治安防控研究,周定平,2011
32,法学,湖南农业大学,规划基金项目,竞争政策视野下商标法理论研究——关系、协调及制度构建,罗晓霞,2011
33,法学,湖南人文科技学院,规划基金项目,农村宅基地使用权法律问题研究,袁锦秀,2011
34,法学,湖南商学院,规划基金项目,能动司法语境下非正式法源适用研究,胡君,2011
35,法学,湖南师范大学,规划基金项目,两岸投资关系的法律问题研究,吴智,2011
36,法学,湖南师范大学,规划基金项目,法院裁判与民意的冲突及其解决机制,朱立恒,2011
37,法学,湖南师范大学,规划基金项目,地方人大与其常委会立法权限划分研究,肖巧平,2011
38,法学,华东政法大学,规划基金项目,《条约保留实践指南》及其与中国条约保留制度完善之研究,王勇,2011
39,法学,华东政法大学,规划基金项目,重罪案件刑事和解中价值冲突及裁判平衡研究,李翔,2011
40,法学,华东政法大学,规划基金项目,十二五期间我国商法领域工作重点——票据法修改,李伟群,2011
41,法学,华东政法大学,规划基金项目,改革中中国立法的作用,刘松山,2011
42,法学,华东政法大学,规划基金项目,经营者合并审查中的效率抗辩制度研究,钟文兴,2011
43,法学,华南理工大学,规划基金项目,基因信息的法律保护与基因伦理的构建,周莳文,2011
44,法学,华南农业大学,规划基金项目,统筹城乡建设用地整理及再开发法律规制研究——基于当前土地“新政”实践之检,王权典,2011
45,法学,华中师范大学,规划基金项目,县级政府依法行政动力的优化与开发研究,姚锐敏,2011
46,法学,淮北师范大学,规划基金项目,区域合作背景下地方联合立法研究,王春业,2011
47,法学,惠州学院,规划基金项目,京师同文馆输入的西方法学及其术语研究——以《万国公法》为中心,万齐洲,2011
48,法学,吉林大学,规划基金项目,我国破产重整制度的法经济学分析,齐明,2011
49,法学,吉林大学,规划基金项目,行政诉讼案例类型化研究,于立深,2011
50,法学,嘉兴学院,规划基金项目,精细化司法证明中逻辑与经验基本问题研究,李树真,2011
51,法学,江南大学,规划基金项目,法律适用中的法律解释之客观性研究,雷玉德,2011
52,法学,江苏大学,规划基金项目,社会资本理论视阈下的公民参与社区矫正研究,周国强,2011
53,法学,江西财经大学,规划基金项目,互联网产业的反垄断法适用问题研究,蒋岩波,2011
54,法学,九江学院,规划基金项目,环境侵害之国家赔偿责任研究,贺思源,2011
55,法学,辽宁大学,规划基金项目,银行监管权配置的法律问题研究,杨松,2011
56,法学,南京大学,规划基金项目,后金融危机时代公司治理规制创新研究,吴建斌,2011
57,法学,南京大学,规划基金项目,经济犯罪刑事政策研究,孙国祥,2011
58,法学,南京理工大学,规划基金项目,反垄断法实施中的行业协会研究——正功能及其机理,董新凯,2011
59,法学,南京审计学院,规划基金项目,我国区（县）法治绩效评估体系研究,刘爱龙,2011
60,法学,南京师范大学,规划基金项目,法院职权优化配置研究,贺日开,2011
61,法学,南京师范大学,规划基金项目,网络民意的司法回应机制研究,季金华,2011
62,法学,曲阜师范大学,规划基金项目,群体性事件下的依法治县研究,张益刚,2011
63,法学,山东大学,规划基金项目,涉外民事关系法律适用法的司法解释问题研究,许庆坤,2011
64,法学,山东工商学院,规划基金项目,刑事瑕疵证据的实证研究与理论阐释,胡忠惠,2011
65,法学,山东理工大学,规划基金项目,环境刑法实施效率研究,张福德,2011
66,法学,山东理工大学,规划基金项目,刑法的边界研究,杨春然,2011
67,法学,山东理工大学,规划基金项目,发展低碳经济的政策法律研究,朱伯玉,2011
68,法学,山东政法学院,规划基金项目,刑事辩护中的利益冲突与执业规范建构研究,杨晓静,2011
69,法学,山东政法学院,规划基金项目,从传统到现代：英国法律人才培养机制转型研究,韩慧,2011
70,法学,山东政法学院,规划基金项目,中韩环境犯罪的比较研究,张霞,2011
71,法学,山西大学,规划基金项目,山西省转型综合改革试验区建设中土地管理机制创新研究,何建华,2011
72,法学,汕头大学,规划基金项目,未成年人救助与保障制度研究,熊金才,2011
73,法学,上海海事大学,规划基金项目,物权法实施中农民土地财产权保护问题研究－－从农地动态利用角度,王铁雄,2011
74,法学,沈阳师范大学,规划基金项目,刑事被害人的社会保障制度研究---以加强和创新社会管理,田鹏辉,2011
75,法学,首都经济贸易大学,规划基金项目,新媒体法律规制研究,郑文明,2011
76,法学,首都经济贸易大学,规划基金项目,国际组织在我国的法律地位,谢海霞,2011
77,法学,四川大学,规划基金项目,中国民间对日索赔中的国际法问题研究—以重庆大轰炸受害者索赔为典型的实,金明,2011
78,法学,四川大学,规划基金项目,清代官箴及其在清代地方司法中的影响——以清代四川为,赵娓妮,2011
79,法学,苏州大学,规划基金项目,私人参与履行警察任务的行政法研究,章志远,2011
80,法学,苏州大学,规划基金项目,城镇化政府推进的程序法理,孙莉,2011
81,法学,天津商业大学,规划基金项目,民事政策的法源性研究,齐恩平,2011
82,法学,武汉大学,规划基金项目,收入分配调整与金融法制的变革——以金融资源的公平配置为中心,冯果,2011
83,法学,武汉大学,规划基金项目,香港特别行政区基本法解释问题研究,秦前红,2011
84,法学,武汉大学,规划基金项目,和谐社会建设与合作式司法改革,任华哲,2011
85,法学,武汉大学,规划基金项目,审计实务中企业合同效力控制研究----以防范国有资产流失为考察点,黎桦,2011
86,法学,西北政法大学,规划基金项目,侵权责任法实施问题研究,孙玉红,2011
87,法学,西北政法大学,规划基金项目,个人的国际刑事责任研究,喻贵英,2011
88,法学,西北政法大学,规划基金项目,社区矫正的风险评估与管控机制研究,冯卫国,2011
89,法学,西南交通大学,规划基金项目,专利添附制度研究——以中国高铁技术创新与发展为例,陈家宏,2011
90,法学,西南科技大学,规划基金项目,社会管理创新下的西部民族地区多元纠纷解决机制研究,刘永强,2011
91,法学,西南民族大学,规划基金项目,城乡统筹背景下“小产权房”法律规制研究,吴爱辉,2011
92,法学,西南政法大学,规划基金项目,量刑程序中的证据和证明问题研究,张吉喜,2011
93,法学,西南政法大学,规划基金项目,风险社会视域下中立参与行为的刑法边界研究——以177个案例和23个司法解释为,李邦友,2011
94,法学,西南政法大学,规划基金项目,完善我国农村土地征收补偿法律制度研究,吴春燕,2011
95,法学,厦门大学,规划基金项目,涉台民商事案件法律适用问题研究——以司法解释为切入点,于飞,2011
96,法学,湘潭大学,规划基金项目,借鉴与移植：外来宪政文化对中国的影响,夏新华,2011
97,法学,新疆大学,规划基金项目,知识产权战略视野下新疆传统知识法律保护研究,王芳,2011
98,法学,烟台大学,规划基金项目,反假冒贸易协定的挑战与对策研究,宋红松,2011
99,法学,盐城师范学院,规划基金项目,公民网络监督法律机制研究,丁大晴,2011
100,法学,燕山大学,规划基金项目,我国社区矫正中人身危险性评估研究,刘立霞,2011
101,法学,扬州大学,规划基金项目,信托制度的民法分析与民法典信托编的制定,刘正峰,2011
102,法学,扬州大学,规划基金项目,共有权行使的制度创新,胡吕银,2011
103,法学,扬州大学,规划基金项目,国家补充责任研究,陈恩才,2011
104,法学,云南大学,规划基金项目,法律起源与国家法形成规律探析—以西南少数民族神话等文本为例,陈永邺,2011
105,法学,浙江大学城市学院,规划基金项目,我国政府非税收入收缴管理规范化研究,谭立,2011
106,法学,浙江工商大学,规划基金项目,中国古代婚姻变动中的妇女权益保障机制及其理念研究,崔兰琴,2011
107,法学,浙江工业大学,规划基金项目,监狱法修订若干问题研究,汪勇,2011
108,法学,浙江工业大学,规划基金项目,当代中国新商人法研究,戴剑波,2011
109,法学,浙江万里学院,规划基金项目,法典化语境中的人格权法,欧世龙,2011
110,法学,郑州大学,规划基金项目,商标使用类型化研究,张德芬,2011
111,法学,中国人民大学,规划基金项目,现行宪法颁布30年实施状况研究,韩大元,2011
112,法学,中国人民大学,规划基金项目,关于“错法”及其纠正机制问题研究,史际春,2011
113,法学,中国人民公安大学,规划基金项目,我国社会转型期的警察权配置问题研究,高文英,2011
114,法学,中国政法大学,规划基金项目,社会保障权救济模式研究,薛小建,2011
115,法学,中国政法大学,规划基金项目,投资非洲争议解决问题研究,祁欢,2011
116,法学,中国政法大学,规划基金项目,电子商务中的商标使用和商标侵权研究,张今,2011
117,法学,中国政法大学,规划基金项目,跨国破产法适用问题比较研究,张玲,2011
118,法学,中国政法大学,规划基金项目,集体土地所有权的宪法地位及其效力研究,张吕好,2011
119,法学,中国政法大学,规划基金项目,法律硕士研究生培养模式和培养质量评价体系研究,王振峰,2011
120,法学,中南财经政法大学,规划基金项目,传统中国的能动司法模式研究——以应对“小事闹大”诉告策略的司法艺术为中心,陈会林,2011
121,法学,中南财经政法大学,规划基金项目,中国古代契约制度及文化研究,春杨,2011
122,法学,中南大学,规划基金项目,电子商务中消费争端解决制度研究,刘益灯,2011
123,法学,中南民族大学,规划基金项目,公司治理的非正式制度依赖与变迁研究,孙光焰,2011
124,法学,重庆大学,规划基金项目,“环境优先”原则的法律确立与制度回应研究,唐绍均,2011
125,法学,重庆三峡学院,规划基金项目,刑事卷证移送制度改革研究,唐治祥,2011
126,法学,安徽财经大学,青年基金项目,国际法院解决领土争端中的证据问题研究,张卫彬,2011
127,法学,安徽财经大学,青年基金项目,从引证看法学领域内外部知识交互影响实证研究,高毅,2011
128,法学,安徽财经大学,青年基金项目,中国证券市场对外开放监管法律制度研究,蒋辉宇,2011
129,法学,安徽大学,青年基金项目,“非理性维权”问题研究,陈晓峰,2011
130,法学,安徽农业大学,青年基金项目,发展农业再保险的财政法律制度研究,龚伟,2011
131,法学,安徽医科大学,青年基金项目,食品侵权责任研究,赵存喜,2011
132,法学,北京大学,青年基金项目,风险规制与行政法治——基于公私区分与互动的视角,金自宁,2011
133,法学,北京工商大学,青年基金项目,失地农民融入城市社区过程中的利益冲突及其法律调整研究,董彪,2011
134,法学,北京航空航天大学,青年基金项目,基本权利的概括限制研究——以我国宪法第51条为中心,王锴,2011
135,法学,北京交通大学,青年基金项目,刑事诉讼视野下的犯罪构成要件——基于刑事诉讼法与刑法互动的研究,陶杨,2011
136,法学,北京理工大学,青年基金项目,欧盟民法典草案研究,付俊伟,2011
137,法学,北京联合大学,青年基金项目,生物技术背景下植物育种创新的知识产权保护研究,李菊丹,2011
138,法学,北京农学院,青年基金项目,农业转基因生物国际贸易的法律调整——基于中国视角的研,佟占军,2011
139,法学,北京师范大学,青年基金项目,刑民交叉案件的程序处理,毛立新,2011
140,法学,北京外国语大学,青年基金项目,民事无财产可供执行案件研究,刘静,2011
141,法学,长安大学,青年基金项目,中国小产权房实证调查与法规对策研究,高亚军,2011
142,法学,大连海事大学,青年基金项目,近代立宪观念史的演变逻辑——从鸦片战争到辛亥革命,王勇,2011
143,法学,大连海事大学,青年基金项目,自然遗产保护的现实困境与法律对策,马明飞,2011
144,法学,大连海事大学,青年基金项目,不完全契约研究,吴煦,2011
145,法学,大连海洋大学,青年基金项目,继承法修改中的重大疑难问题研究,刘耀东,2011
146,法学,大连理工大学,青年基金项目,推进高端装备制造产业技术创新联盟发展的政策法律对策研,王越,2011
147,法学,大庆师范学院,青年基金项目,中国死刑观念的现状、形成机理及其重塑研究,曾赛刚,2011
148,法学,东北林业大学,青年基金项目,我国建立REDD机制国内法律框架问题研究,荆珍,2011
149,法学,东北师范大学,青年基金项目,劳动者工作环境权研究,张晓阳,2011
150,法学,东北师范大学,青年基金项目,网络游戏与青少年犯罪相关性的实证研究,刘亚娜,2011
151,法学,东华理工大学,青年基金项目,稀有金属矿产资源开发生态补偿法律问题研究,戴茂华,2011
152,法学,对外经济贸易大学,青年基金项目,生命权的伦理反思和制度重构,马特,2011
153,法学,对外经济贸易大学,青年基金项目,“国家与社会”视角下的民事司法改革,陈杭平,2011
154,法学,佛山科学技术学院,青年基金项目,罪量视野下的犯罪论体系诸问题之困境与出路,彭文华,2011
155,法学,佛山科学技术学院,青年基金项目,慈善法人研究,王雪琴,2011
156,法学,阜阳师范学院,青年基金项目,基因医疗技术的法律问题研究——以权利冲突和损害救济为,王康,2011
157,法学,复旦大学,青年基金项目,法国侵权责任法改革：传统特色与欧洲私法一体化的冲突与,李世刚,2011
158,法学,复旦大学,青年基金项目,公共政策的竞争评估,张占江,2011
159,法学,复旦大学,青年基金项目,中国古代的情理法研究,林曦,2011
160,法学,广东海洋大学,青年基金项目,南海油气资源合作与开发的制度及实践研究,许浩,2011
161,法学,广东商学院,青年基金项目,风险社会中事故型犯罪的监督过失研究,谢雄伟,2011
162,法学,广西民族大学,青年基金项目,环境物权的公法逻辑——以公共权力对环境物权品格之型塑为视角,黄中显,2011
163,法学,广西师范大学,青年基金项目,西部农村地区人民调解制度的功能强化研究,胡辉,2011
164,法学,广州大学,青年基金项目,后危机时代衍生金融监管变革的法律问题研究,阳建勋,2011
165,法学,广州大学,青年基金项目,先合同责任研究,邱雪梅,2011
166,法学,广州体育学院,青年基金项目,我国运动员权益保护制度立法研究,蒙雪,2011
167,法学,贵州大学,青年基金项目,《中国刑事卷宗制度研究》,李长城,2011
168,法学,贵州大学,青年基金项目,物权法视域下矿业权的权利构造与制度重塑研究,胡卫,2011
169,法学,贵州大学,青年基金项目,自然灾害时期的国家人权义务,廖艳,2011
170,法学,国际关系学院,青年基金项目,要件事实理论在侵权案件中的适用研究,许可,2011
171,法学,哈尔滨理工大学,青年基金项目,法治视野中的中国行政道歉制度研究,王晨,2011
172,法学,杭州师范大学,青年基金项目,食品安全监管研究——从化解社会失范的视角,陈仕学,2011
173,法学,河海大学,青年基金项目,垄断行业搁置成本法律规制研究,徐金海,2011
174,法学,河南财经政法大学,青年基金项目,美国侵权法改革运动研究,王晓明,2011
175,法学,河南工业大学,青年基金项目,我国中央与地方权限争议法律解决机制研究,谭波,2011
176,法学,河南师范大学,青年基金项目,从“异子之科”到“别籍异财法”,尹成波,2011
177,法学,黑龙江大学,青年基金项目,俄罗斯犯罪构成理论体系研究,庞冬梅,2011
178,法学,黑龙江大学,青年基金项目,土地整合背景下农民权益保护问题与对策研究,王佳慧,2011
179,法学,黑龙江大学,青年基金项目,俄罗斯矿产资源政策及矿产开发法律问题研究,李连祺,2011
180,法学,湖南大学,青年基金项目,社会风险防范和刑法义务构建,姚诗,2011
181,法学,湖南大学,青年基金项目,云计算技术相关版权法问题研究,喻玲,2011
182,法学,湖南工学院,青年基金项目,侦查中的网络通讯监听法制化研究,欧阳爱,2011
183,法学,湖南师范大学,青年基金项目,外国法查明中的“专家意见”制度比较研究,王葆莳,2011
184,法学,湖南师范大学,青年基金项目,我国应对多哈回合农业谈判未决议题的法律对策研究,何燕华,2011
185,法学,湖州师范学院,青年基金项目,中国早期佛教的法律调控研究,谢舟,2011
186,法学,华东政法大学,青年基金项目,我国刑事扣押的理论与实践问题研究,张栋,2011
187,法学,华东政法大学,青年基金项目,全球化背景下国际税收行政合作机制研究,张泽平,2011
188,法学,华东政法大学,青年基金项目,对中国转型社会犯罪控制的新研究——以网络传播为视角,叶慧娟,2011
189,法学,华东政法大学,青年基金项目,雇主不当劳动行为认定基准与救济机制研究,饶志静,2011
190,法学,华东政法大学,青年基金项目,垄断行业的规制改革与竞争政策研究,施海渊,2011
191,法学,华东政法大学,青年基金项目,组织法视野中的商事信托研究,季奎明,2011
192,法学,华东政法大学,青年基金项目,后现代女性主义视野下的法律性别问题研究——以我国法律体系为文本的分析,马姝,2011
193,法学,华东政法大学,青年基金项目,住房租赁法的立法宗旨与制度建构——以承租人利益保护为,周珺,2011
194,法学,华南师范大学,青年基金项目,通过“良法”的自治：我国省级村民自治地方立法质量研究——基于法律实证的分,刘志鹏,2011
195,法学,华南师范大学,青年基金项目,私法惩罚论---以侵权法为中心,阳庚德,2011
196,法学,华侨大学,青年基金项目,后金融危机时代审慎监管的国际协调与合作研究——以法律冲突为视角,吴永辉,2011
197,法学,华侨大学,青年基金项目,股指期货和股票现货跨市场交易风险的法律监管研究——以宏观审慎为中心,陈斌彬,2011
198,法学,华侨大学,青年基金项目,群体性纠纷的示范诉讼解决机制研究,陈慰星,2011
199,法学,吉林大学,青年基金项目,刑罚的科学设定与适用：基于比较法的一种技术性反思,李立丰,2011
200,法学,吉林师范大学,青年基金项目,上市公司重整中债权人与中小股东的法律保护,王佐发,2011
201,法学,江西财经大学,青年基金项目,转型时期弱势群体犯罪防控研究,郭晓红,2011
202,法学,江西师范大学,青年基金项目,非常态司法——抗日战争对民国司法的影响,罗金寿,2011
203,法学,喀什师范学院,青年基金项目,民事习惯在新疆法院调解和判决中的运用——以喀什地区为中心的调查和研究,江钦辉,2011
204,法学,鲁东大学,青年基金项目,大规模产品侵权中的市场份额责任研究,蔡颖雯,2011
205,法学,南方医科大学,青年基金项目,医疗责任保险制度的法理基础分析和制度构建,吕群蓉,2011
206,法学,南京大学,青年基金项目,欧盟对外关系法与中欧关系的和谐发展,张华,2011
207,法学,南京大学,青年基金项目,转型时期法官裁判思维研究,蔡琳,2011
208,法学,南京师范大学,青年基金项目,公共政策进入司法的风险评估与规避,方乐,2011
209,法学,南京信息工程大学,青年基金项目,从公议到公断：清末民初的商事公断制度研究,张松,2011
210,法学,南京信息工程大学,青年基金项目,我国陆源污染防治法律制度研究,戈华清,2011
211,法学,南京信息工程大学,青年基金项目,网络服务提供者的侵权认定与责任承担研究,蒋洁,2011
212,法学,清华大学,青年基金项目,市场交易中法律规避现象的实证研究,董淳锷,2011
213,法学,三峡大学,青年基金项目,健康权的国家义务研究,邓海娟,2011
214,法学,山东大学,青年基金项目,我国人体基因科技发展的人权保障研究-立法的视角,沈秀芹,2011
215,法学,山东科技大学,青年基金项目,温室气体排放控制法律制度研究,刘明明,2011
216,法学,山东女子学院,青年基金项目,农村留守妇女婚姻权益法律保护调查研究,王绍霞,2011
217,法学,山东师范大学,青年基金项目,“诉讼文化冲突”视野下的民事诉讼法修改研究,王德新,2011
218,法学,上海大学,青年基金项目,预防性行政诉讼研究,赵清林,2011
219,法学,上海大学,青年基金项目,经营者集中反垄断救济措施运行机制研究,李俊峰,2011
220,法学,上海对外贸易学院,青年基金项目,新形势下金融稳定和投资者保护法律制度研究——以金融系统性风险为视角,蔺捷,2011
221,法学,上海交通大学,青年基金项目,债务人财产查明制度研究,赵秀举,2011
222,法学,上海交通大学,青年基金项目,土地承包经营权集合信托模式的建构逻辑与制度设计——土地承包经营权实现方式,徐卫,2011
