序号,学科门类,学校名称,项目类别,项目名称,申请人,年份
3061,外国文学,湖南师范大学,青年基金项目,加里斯奈德与禅宗文化,罗坚,2011
3062,外国文学,华东师范大学,青年基金项目,西方马克思主义学者对经典文艺作品的阐释研究,陶国山,2011
3063,外国文学,吉林大学,青年基金项目,当代美国后“9·11”小说叙事伦理研究,朴玉,2011
3064,外国文学,济南大学,青年基金项目,后殖民女性主义视阈下的马琳.诺比斯.菲利普诗歌研究,吴丽,2011
3065,外国文学,江西理工大学,青年基金项目,英诗中国形象的客体输入与反观,曾繁健,2011
3066,外国文学,南昌大学,青年基金项目,弗兰纳里·奥康纳小说研究,肖明文,2011
3067,外国文学,南昌航空大学,青年基金项目,勒克莱齐奥生态文明批判,冯克红,2011
3068,外国文学,南京财经大学,青年基金项目,乔治爱略特小说社会政治思想研究,王海萌,2011
3069,外国文学,南京大学,青年基金项目,加拿大华人文学史论：多元和整合,赵庆庆,2011
3070,外国文学,南京理工大学,青年基金项目,阿契贝与非洲后殖民小说,姚峰,2011
3071,外国文学,南开大学,青年基金项目,日本古代大陆移民的文学研究,王凯,2011
3072,外国文学,青岛大学,青年基金项目,菲利普·罗斯后期小说中犹太人生存状态研究,孟宪华,2011
3073,外国文学,山东大学,青年基金项目,列·安德列耶夫创作研究,李建刚,2011
3074,外国文学,陕西师范大学,青年基金项目,英国动物叙事文学研究：1150-1500,张亚婷,2011
3075,外国文学,上海海洋大学,青年基金项目,上海在日本近现代文学史上的隐喻意义,齐珮,2011
3076,外国文学,上海师范大学,青年基金项目,中学西传:中国古典诗歌的西译与传播(1912－1963)—以W.C.威廉斯为代表,武新玉,2011
3077,外国文学,四川大学,青年基金项目,空间叙事理论视阈中的纳博科夫小说研究,王安,2011
3078,外国文学,四川大学,青年基金项目,创伤、记忆和历史：美国南方创伤小说研究,王欣,2011
3079,外国文学,苏州大学,青年基金项目,悖反之艺与存在之思——卡夫卡作品叙事艺术研究,张莉,2011
3080,外国文学,武汉大学,青年基金项目,洛克的哲学和十八世纪英国文学,王爱菊,2011
3081,外国文学,武汉大学,青年基金项目,易卜生私密文献翻译与研究,汪余礼,2011
3082,外国文学,西北师范大学,青年基金项目,帕慕克与东西方文学传统的比较研究,陈玉洪,2011
3083,外国文学,湘潭大学,青年基金项目,波伏瓦在中国的传播与阐释,王芳,2011
3084,外国文学,云南师范大学,青年基金项目,格温朵琳·布鲁克斯诗歌研究,史丽玲,2011
3085,外国文学,浙江财经学院,青年基金项目,奥登诗学思想研究,蔡海燕,2011
3086,外国文学,中国计量学院,青年基金项目,现象学视阈下的威廉斯诗歌美学研究,梁晶,2011
3087,外国文学,中南财经政法大学,青年基金项目,东北沦陷时期日本殖民主义文学研究与批判,雷鸣,2011
3088,心理学,复旦大学,规划基金项目,错误记忆的神经基础：基于提取过程的研究,周楚,2011
3089,心理学,广州大学,规划基金项目,道德决策的认知与神经机制研究,路红,2011
3090,心理学,湖南第一师范学院,规划基金项目,家庭处境不利对农村留守儿童情绪适应问题的影响机制：追踪研究,范兴华,2011
3091,心理学,湖南科技大学,规划基金项目,初中生生活事件和认知图式对其抑郁症状影响机制的追踪与干预研究,吴文峰,2011
3092,心理学,湖南师范大学,规划基金项目,不同人格特质个体的内隐自我信息加工研究,钟毅平,2011
3093,心理学,湖南师范大学,规划基金项目,基于IRT展开模型的中小学生学习行为测评研究,范晓玲,2011
3094,心理学,华东师范大学,规划基金项目,参与群体行动：中国文化背景下群体行动驱动的社会心理机,崔丽娟,2011
3095,心理学,华南师范大学,规划基金项目,学习判断与学习时间分配的关系及其运行机制研究,刘学兰,2011
3096,心理学,济南大学,规划基金项目,社区心理危机干预的理论与行动研究,王本法,2011
3097,心理学,辽宁师范大学,规划基金项目,高中生自尊发展与培养研究,张丽华,2011
3098,心理学,辽宁师范大学,规划基金项目,汉语听觉语音加工的认知机制,任桂琴,2011
3099,心理学,山东师范大学,规划基金项目,中国父母体罚和身体虐待与儿童青少年适应的关系及其作用,王美芳,2011
3100,心理学,山西大学,规划基金项目,高校学生心理安全教育、问题预防、症状处理及危机应对的,范红霞,2011
3101,心理学,首都体育学院,规划基金项目,有氧锻炼促进情绪调节的脑神经机制研究,蒋长好,2011
3102,心理学,首都医科大学,规划基金项目,儿科医务人员心理健康状况和生活质量现状调查及影响因素,王旭,2011
3103,心理学,天津大学,规划基金项目,大学生生命感的时代解读及提升路径研究,孙颖,2011
3104,心理学,天津师范大学,规划基金项目,知识型城市低龄老年人再职业生涯心理与行为模式研究,王晓庄,2011
3105,心理学,天津师范大学,规划基金项目,中小学生学习中的协作抑制,唐卫海,2011
3106,心理学,天津医科大学,规划基金项目,“癌症生存者”的创伤后成长,刘惠军,2011
3107,心理学,潍坊医学院,规划基金项目,学龄期哮喘儿童的心理行为问题及综合性心理干预的研究,孙宏伟,2011
3108,心理学,西南民族大学,规划基金项目,大学生归纳风格分类调查及其对大学生网络行为特征的预期,蒋柯,2011
3109,心理学,徐州师范大学,规划基金项目,当代青少年生命意义感研究,贾林祥,2011
3110,心理学,盐城工学院,规划基金项目,青少年情绪调节中注意分散策略的ERP研究,张文海,2011
3111,心理学,扬州大学,规划基金项目,心理训练和体育锻炼联合干预大学生心理压力的研究,颜军,2011
3112,心理学,浙江大学,规划基金项目,注视知觉的社会认知特征及其机制,张智君,2011
3113,心理学,郑州大学,规划基金项目,青少年抑郁障碍与品行障碍共病的实证及多维病因学模型研,耿耀国,2011
3114,心理学,中南大学,规划基金项目,荣格道德整合思想及其当代价值,叶湘虹,2011
3115,心理学,中山大学,规划基金项目,中国式情绪调控特点的实证研究,黄敏儿,2011
3116,心理学,安徽农业大学,青年基金项目,留守儿童亲子分离适应过程的理论与实证研究,余益兵,2011
3117,心理学,北京理工大学,青年基金项目,提升大学生幸福感——基于心智觉知的团体干预模式研究,李波,2011
3118,心理学,北京林业大学,青年基金项目,虚拟现实暴露疗法治疗考试焦虑研究,王广新,2011
3119,心理学,北京师范大学,青年基金项目,青少年网络游戏成瘾的生物反馈干预研究,张锦涛,2011
3120,心理学,北京师范大学,青年基金项目,中小学生人格测评中的社会称许性反应研究,骆方,2011
3121,心理学,北京师范大学,青年基金项目,早期教养经历对儿童心理发展影响的纵向研究,李燕芳,2011
3122,心理学,北京师范大学,青年基金项目,流动儿童歧视知觉的产生机制及与情绪适应的关系,刘霞,2011
3123,心理学,北京中医药大学,青年基金项目,基于意境作业诱发ERP的具象思维养心安神机制研究,魏玉龙,2011
3124,心理学,福建医科大学,青年基金项目,重症监护后创伤后应激障碍的发生机制与干预对策研究,胡蓉芳,2011
3125,心理学,赣南师范学院,青年基金项目,青少年网络利他行为的影响因素与干预研究,郑显亮,2011
3126,心理学,杭州师范大学,青年基金项目,社会价值取向对决策行为的影响及其神经基础,吴燕,2011
3127,心理学,华南理工大学,青年基金项目,青少年生命意义感及其对心理危机的调节机制研究,吴文丽,2011
3128,心理学,华南师范大学,青年基金项目,社会技能训练对青少年学校适应影响模式的中日比较研究,黄喜珊,2011
3129,心理学,华南师范大学,青年基金项目,左侧额下回参与语义整合的机制,朱祖德,2011
3130,心理学,华中农业大学,青年基金项目,偏见调控的心理机制研究,张陆,2011
3131,心理学,华中师范大学,青年基金项目,网络游戏引发青少年时间知觉改变的认知与神经机制,程晓荣,2011
3132,心理学,华中师范大学,青年基金项目,视觉通道中空间位置加工对时间知觉的影响和约束,范炤,2011
3133,心理学,华中师范大学,青年基金项目,童年期亲子互动、同伴交往与心理理论的关系研究,孙晓军,2011
3134,心理学,黄冈师范学院,青年基金项目,数学-性别刻板印象的调查及其威胁效应的研究,宋淑娟,2011
3135,心理学,吉林大学,青年基金项目,道德判断与惩罚决定的中、美比较研究,张彦彦,2011
3136,心理学,吉林大学,青年基金项目,亲职教育的实效性及应用策略研究,孙蕾,2011
3137,心理学,江西师范大学,青年基金项目,认知诊断CAT的技术开发与应用,蔡艳,2011
3138,心理学,辽宁师范大学,青年基金项目,情绪启动与语义启动的直接而系统性实验比较,蒋重清,2011
3139,心理学,绵阳师范学院,青年基金项目,地震亲历者创伤心理的特点及其干预,张妍,2011
3140,心理学,南昌工程学院,青年基金项目,大学生自杀预警系统构建研究,巢传宣,2011
3141,心理学,南京大学,青年基金项目,情绪、情绪调节与风险决策,李中权,2011
3142,心理学,南京航空航天大学,青年基金项目,第二外语学习过程中学习者的满足延迟和自我制约方略的使,张黎黎,2011
3143,心理学,南京师范大学,青年基金项目,创伤后心理应激障碍脑功能网络改变的多模态影像学研究,钟元,2011
3144,心理学,南开大学,青年基金项目,集体行动参与机制的社会心理学研究,陈浩,2011
3145,心理学,南通大学,青年基金项目,具身认知视角的青少年情绪性概念加工及发展,王柳生,2011
3146,心理学,山东师范大学,青年基金项目,父母支持、朋友支持对青少年心理社会适应的影响：从发展的角度检验三个模型,田录梅,2011
3147,心理学,陕西师范大学,青年基金项目,科学创造力与艺术创造力：启动效应及领域影响,衣新发,2011
3148,心理学,陕西师范大学,青年基金项目,特质与状态依恋背景下青少年感戴对心理健康促进机制的研,李彩娜,2011
3149,心理学,上海师范大学,青年基金项目,学习困难中学生的认知加工特征及其与学业智力关系模型研,蔡丹,2011
3150,心理学,沈阳体育学院,青年基金项目,我国注意缺陷与多动儿童社会功能发展特征及运动干预机制的构建与实践,孙拥军,2011
3151,心理学,首都师范大学,青年基金项目,大学生求职意愿缺失的心理机制及预警体系,汪玲,2011
3152,心理学,首都医科大学,青年基金项目,基于fMRI和ACT-R的数字归纳推理的计算认知建模研究,梁佩鹏,2011
3153,心理学,首都医科大学,青年基金项目,心理契约视角下医务人员主观幸福感的实证性研究,于丽玲,2011
3154,心理学,苏州大学,青年基金项目,注意缺陷多动障碍儿童的干预研究,杨双,2011
3155,心理学,天津师范大学,青年基金项目,情绪体验和调节的年老化研究,王芹,2011
3156,心理学,武汉理工大学,青年基金项目,大学生职业决策困难的分层分类研究,谢宝国,2011
3157,心理学,西南大学,青年基金项目,颜色类别知觉的产生机制,刘强,2011
3158,心理学,徐州师范大学,青年基金项目,青少年感恩的发生机制及干预实验研究,孙配贞,2011
3159,心理学,浙江大学,青年基金项目,分数和小数的表征与互化研究,汪运起,2011
3160,心理学,浙江理工大学,青年基金项目,面孔加工的专家化:分类与个体识别,王哲,2011
3161,心理学,中国人民大学,青年基金项目,家庭微系统影响学业情绪的纵向研究,董妍,2011
3162,心理学,中山大学,青年基金项目,面孔识别本族效应的归类个体化模型检测,周国梅,2011
3163,心理学,中山大学,青年基金项目,大学生创造力观念：基于个人认识论的特点及促进研究,杨小洋,2011
3164,心理学,中山大学,青年基金项目,类别学习的双机制及阻碍效应,陈琳,2011
3165,新闻学与传播学,北京大学,规划基金项目,当代影像产业中奇观文化的经济分析和文化研究,吴靖,2011
3166,新闻学与传播学,东华大学,规划基金项目,时尚文化传播的价值导向研究,王梅芳,2011
3167,新闻学与传播学,福建师范大学,规划基金项目,在线交叉社交网络中链接关联的传播机制研究,肖如良,2011
3168,新闻学与传播学,复旦大学,规划基金项目,传播新科技、知识劳工与市场经济转型,曹晋,2011
3169,新闻学与传播学,复旦大学,规划基金项目,互联网与中国政治文化转型研究,章平,2011
3170,新闻学与传播学,广东外语外贸大学,规划基金项目,大众传媒在重大突发公共事件中的危机预警和沟通机制研究,朱颖,2011
3171,新闻学与传播学,河北经贸大学,规划基金项目,“网络水军”问题研究,张波,2011
3172,新闻学与传播学,湖南大学,规划基金项目,中国传媒产业集簇高端化发展理论建构与实践模式研究,王国平,2011
3173,新闻学与传播学,湖南工业大学,规划基金项目,媒介生态史观：关于建构中国新闻史主体性话语的方法论研,阳海洪,2011
3174,新闻学与传播学,湖南师范大学,规划基金项目,经济新闻传播效果研究,肖鲁仁,2011
3175,新闻学与传播学,华南理工大学,规划基金项目,孔子学院中方教师的跨文化适应和传播能力研究,安然,2011
3176,新闻学与传播学,华中科技大学,规划基金项目,基于知识管理的网络舆情监测与应用研究,陈少华,2011
3177,新闻学与传播学,华中科技大学,规划基金项目,新媒体广告传播研究,舒咏平,2011
3178,新闻学与传播学,昆明理工大学,规划基金项目,我国跨界少数民族地区的国家形象传播研究——以傣族为例,薛翠微,2011
3179,新闻学与传播学,兰州大学,规划基金项目,新媒体在西北农村信息传播中的效果研究,王芳,2011
3180,新闻学与传播学,兰州大学,规划基金项目,西北省级卫视困境与出路研究,韩亮,2011
3181,新闻学与传播学,内蒙古大学,规划基金项目,边疆民族地区网络媒介在社会动员中的作用研究,马强,2011
3182,新闻学与传播学,南昌大学,规划基金项目,我国网络问政长效机制研究——基于网络问政行为偏好的实证分析,刘西平,2011
3183,新闻学与传播学,南京大学,规划基金项目,网民政治性表达法治保障研究,陈堂发,2011
3184,新闻学与传播学,南京大学,规划基金项目,传媒产业关联：理论与实证分析,丁和根,2011
3185,新闻学与传播学,宁波大学,规划基金项目,网络社区关系模型对慈善捐助行为的影响机制研究,王丽,2011
3186,新闻学与传播学,莆田学院,规划基金项目,20世纪70年代海外“保钓”时期中国留学生办刊办报活动研,孟建煌,2011
3187,新闻学与传播学,清华大学,规划基金项目,基于微博的表达权与“理想的传播情景”,王君超,2011
3188,新闻学与传播学,陕西理工学院,规划基金项目,新媒体环境下西部农村信息传播有效性研究,闵阳,2011
3189,新闻学与传播学,汕头大学,规划基金项目,国家与社会理论视角下的网络反腐研究,程金福,2011
3190,新闻学与传播学,上海大学,规划基金项目,当代密苏里新闻教育新范式及其在中国的应用的可行性研究,李建新,2011
3191,新闻学与传播学,邵阳学院,规划基金项目,报刊舆论与中国近代化进程,刘兴豪,2011
3192,新闻学与传播学,苏州大学,规划基金项目,美国总统选举中的民意调查与政治（1932-2008）,张健,2011
3193,新闻学与传播学,武汉工业学院,规划基金项目,转企改制背景下我国报刊社会责任治理及其模型研究,包国强,2011
3194,新闻学与传播学,武汉理工大学,规划基金项目,数字出版存在形态的研究,王汉熙,2011
3195,新闻学与传播学,扬州大学,规划基金项目,错时空与本土化：比较视野下中国电视纪录片风格衍变50年,武新宏,2011
3196,新闻学与传播学,浙江财经学院,规划基金项目,中国文化产业评估指标与内涵式发展战略研究,李涛,2011
3197,新闻学与传播学,浙江工商大学,规划基金项目,基于国际间环境信息沟通的环境意识转移研究,徐少丹,2011
3198,新闻学与传播学,浙江工业大学,规划基金项目,美国公共电视的运作机制及其启示意义研究,王哲平,2011
3199,新闻学与传播学,中国传媒大学,规划基金项目,新媒体环境下重大突发危机事件谣言传播与控制研究,王灿发,2011
3200,新闻学与传播学,中山大学,规划基金项目,城市抗争型公共事件的议题呈现与媒介生态,张宁,2011
3201,新闻学与传播学,安徽大学,青年基金项目,中国新纪录运动中的底层影像研究（1991-2010）,罗锋,2011
3202,新闻学与传播学,安徽大学,青年基金项目,网络“社会抗争”的嬗变及信息流动与预警机制研究,金萍华,2011
3203,新闻学与传播学,安徽师范大学,青年基金项目,明清文化传播与商业互动研究：基于徽州出版与徽商的考察,秦宗财,2011
3204,新闻学与传播学,北京印刷学院,青年基金项目,移动互联网时代，我国电子阅读产业的现状与发展趋势研究,王平,2011
3205,新闻学与传播学,北京语言大学,青年基金项目,社会性媒体的政治功能研究,郑一卉,2011
3206,新闻学与传播学,长江大学,青年基金项目,制播分离语境下的中部地区民营电视产业发展研究,刘远军,2011
3207,新闻学与传播学,长江师范学院,青年基金项目,媒体融合背景下提升党报“三农”报道传播力对策研究,冉明仙,2011
3208,新闻学与传播学,长沙学院,青年基金项目,晚清时期大众传媒的政府形象建构研究——以《湘报》为例,阳海燕,2011
3209,新闻学与传播学,复旦大学,青年基金项目,网络隐私保护与网民数据安全研究：以网民隐私关注为研究,申琦,2011
3210,新闻学与传播学,广东金融学院,青年基金项目,融合背景下的电信媒介发展研究,聂莉,2011
3211,新闻学与传播学,海南师范大学,青年基金项目,族群认同、国家认同良性互动中的文化传播体系研究,卿志军,2011
3212,新闻学与传播学,合肥工业大学,青年基金项目,新媒介与中国农民致富的实证研究,史梁,2011
3213,新闻学与传播学,河海大学,青年基金项目,转型期社会中国电视媒体的价值传播研究,易前良,2011
3214,新闻学与传播学,湖南师范大学,青年基金项目,基于ZMET的中国当代广告原型研究,刘潆檑,2011
3215,新闻学与传播学,华东师范大学,青年基金项目,中国数字出版十年研究（2000-2010年）,肖洋,2011
3216,新闻学与传播学,华东师范大学,青年基金项目,重大突发公共事件的信息发布与传播效果研究,于晶,2011
3217,新闻学与传播学,华南理工大学,青年基金项目,大众传媒在中国现代化转型期的社会整合功能研究——以珠三角外来务工人员媒介,陈娟,2011
3218,新闻学与传播学,华南理工大学,青年基金项目,中国网络媒体品牌构建与评估研究,高辉,2011
3219,新闻学与传播学,华南师范大学,青年基金项目,海外中国新闻传播研究的范式变迁（1951-2010）,刘兢,2011
3220,新闻学与传播学,华南师范大学,青年基金项目,图式的竞争：我国青少年接触海外影视作品及对本国文化的认同危机研究,杨银娟,2011
3221,新闻学与传播学,华中科技大学,青年基金项目,中国国家形象之海外构建的理论与实证研究—以新加坡《联合早报》的传播效果为,徐明华,2011
3222,新闻学与传播学,华中科技大学文华学,青年基金项目,“媒介事件”与转型期政府公信力提升研究,陈奕,2011
3223,新闻学与传播学,华中农业大学,青年基金项目,基于利益博弈的弱势群体诉求表达的传媒功能调适与系统改革研究,钱广贵,2011
3224,新闻学与传播学,华中师范大学,青年基金项目,重大突发公共事件舆情衍变的社会网络研究,周莉,2011
3225,新闻学与传播学,惠州学院,青年基金项目,网络公共领域的理论与实践研究——基于新媒体事件的实证,许鑫,2011
3226,新闻学与传播学,暨南大学,青年基金项目,新媒体语境下的危机沟通研究,汤景泰,2011
3227,新闻学与传播学,兰州大学,青年基金项目,藏族影视文化传播效果与策略研究,王晓红,2011
3228,新闻学与传播学,辽宁大学,青年基金项目,网络即时互动群组的舆论生成机制及引导研究,安珊珊,2011
3229,新闻学与传播学,闽江学院,青年基金项目,中国农业品牌的品牌结构优选模型研究,戴程,2011
3230,新闻学与传播学,南京大学,青年基金项目,网络迷群体文化研究,朱丽丽,2011
3231,新闻学与传播学,南京师范大学,青年基金项目,喉舌与训政：国民党新闻事业研究（1927-1937）,刘继忠,2011
3232,新闻学与传播学,宁波大学,青年基金项目,人民公社的政治传播与社会动员研究（1958-1962）,李乐,2011
3233,新闻学与传播学,宁夏大学,青年基金项目,大众传媒回应与引领当代社会思潮问题研究,宫京成,2011
3234,新闻学与传播学,曲阜师范大学,青年基金项目,新媒体语境下电视主流媒体的舆论引导研究——以中央电视台为个案,刘波,2011
3235,新闻学与传播学,山东科技大学,青年基金项目,不同的声音：网络虚拟社区中国女性的情感话题传播研究,李晓梅,2011
3236,新闻学与传播学,上海财经大学,青年基金项目,全球化时代我国媒体的非洲移民报道和网络舆论研究,党芳莉,2011
3237,新闻学与传播学,上海对外贸易学院,青年基金项目,李普曼新闻思想研究,叶青青,2011
3238,新闻学与传播学,上海交通大学,青年基金项目,大部制改革背景下三网融合的机遇、挑战和对策研究,刘锐,2011
3239,新闻学与传播学,上海交通大学,青年基金项目,生态危机报道与可持续发展：环境新闻在我国面临的问题与对策研究,王积龙,2011
3240,新闻学与传播学,深圳大学,青年基金项目,媒体中介的公共商议研究,张田田,2011
3241,新闻学与传播学,沈阳大学,青年基金项目,城市文化品牌传播战略研究,孙琳琳,2011
3242,新闻学与传播学,天津外国语大学,青年基金项目,绿色发展与媒体创新：环境传播视阈中的当代中国可持续发展研究,张建中,2011
3243,新闻学与传播学,同济大学,青年基金项目,基于生态发展指数的网络文化产业公共治理模式研究,解学芳,2011
3244,新闻学与传播学,西北大学,青年基金项目,我国城市化进程中的社区传播研究,赵勋,2011
3245,新闻学与传播学,西北师范大学,青年基金项目,符号、语境、传播及意义的生成——网络舆论的符号学分析,李红,2011
3246,新闻学与传播学,西南交通大学,青年基金项目,艾滋患者媒介框架与社会距离感的实证研究,蒋宁平,2011
3247,新闻学与传播学,西南民族大学,青年基金项目,微博舆论传播风险管理研究,吴闻莺,2011
3248,新闻学与传播学,西南政法大学,青年基金项目,电视创新模式的知识产权边界——电视娱乐节目模板的构成与侵权研究,陈笑春,2011
3249,新闻学与传播学,西南政法大学,青年基金项目,媒体与社会信任危机研究,郭晓科,2011
3250,新闻学与传播学,厦门大学,青年基金项目,从广告传播表现解读转型期中国城市居民消费观念变迁（1978－2010）,陈素白,2011
3251,新闻学与传播学,新疆大学,青年基金项目,媒介传播视域下的少数民族地区受众国家认同研究——基于托台村民族志调查,金玉萍,2011
3252,新闻学与传播学,云南民族大学,青年基金项目,两岸新闻教育比较研究,黄东英,2011
3253,新闻学与传播学,浙江大学,青年基金项目,转型期我国贪腐新闻的媒介社会学研究——基于新闻语料、新闻生产及传播效果的,李东晓,2011
3254,新闻学与传播学,浙江大学,青年基金项目,微博动员与集体行动研究,韦路,2011
3255,新闻学与传播学,浙江大学,青年基金项目,为了忘却的纪念：南京大屠杀集体记忆的建构与传播,李红涛,2011
3256,新闻学与传播学,中国传媒大学,青年基金项目,我国电影产业国际竞争力测度研究,金雪涛,2011
3257,新闻学与传播学,中国传媒大学,青年基金项目,《加强我国广电传媒国际传播能力建设研究》,段鹏,2011
3258,新闻学与传播学,中国传媒大学,青年基金项目,三网融合背景下内容提供商的产业地位重塑及发展战略研究,卜彦芳,2011
3259,新闻学与传播学,中国青年政治学院,青年基金项目,互联网使用与青年农民工社会发展——基于京广沪三地的实证研究,何晶,2011
