序号,学科门类,学校名称,项目类别,项目名称,申请人,年份
1,马克思主义/思想政治教育,安徽科技学院,规划基金项目,社会主义核心价值观融入农民日常生活研究,王方友,2016
2,马克思主义/思想政治教育,北京师范大学,规划基金项目,教师誓词研究,方增泉,2016
3,马克思主义/思想政治教育,成都理工大学,规划基金项目,在四川藏区开展精准思想政治教育方法路径研究,夏达,2016
4,马克思主义/思想政治教育,佛山科学技术学院,规划基金项目,网络文化异化境遇下大学生虚拟生存的社会责任践行研究,林瑞青,2016
5,马克思主义/思想政治教育,广东财经大学,规划基金项目,马克思主义中国化的世界向度研究,仇小敏,2016
6,马克思主义/思想政治教育,合肥工业大学,规划基金项目,“多元互动”式大学生社会实践育人理念创新与机制构建,檀江林,2016
7,马克思主义/思想政治教育,河北师范大学,规划基金项目,欧美“波普享乐主义”对我国的危害与对策,程立涛,2016
8,马克思主义/思想政治教育,湖南工业大学,规划基金项目,马克思利益机制思想视域下共享发展研究,龙迎伟,2016
9,马克思主义/思想政治教育,华东师范大学,规划基金项目,香港地区大学生国家认同的影响因素与提升路径研究,陈正桂,2016
10,马克思主义/思想政治教育,淮阴师范学院,规划基金项目,习近平总书记党员干部思想教育理论研究,赵国付,2016
11,马克思主义/思想政治教育,吉林大学,规划基金项目,共享发展理念的马克思主义分配正义理论溯源与创新研究,罗克全,2016
12,马克思主义/思想政治教育,吉林大学,规划基金项目,“绿色发展”理念引领下的生态价值观养成研究,张敏,2016
13,马克思主义/思想政治教育,江南大学,规划基金项目,中国纪检监察派驻机构管理模式创新研究,鞠连和,2016
14,马克思主义/思想政治教育,九江学院,规划基金项目,当代中国社会风气的守与变,李玉林,2016
15,马克思主义/思想政治教育,南昌师范学院,规划基金项目,高校思想政治工作日常叙事的结构分析与效用模型建设研究,向绪伟,2016
16,马克思主义/思想政治教育,南京大学,规划基金项目,孙中山形象与中华民族认同研究,李恭忠,2016
17,马克思主义/思想政治教育,南京理工大学,规划基金项目,环境道德教育与生态文明建设互动机制研究,朱国芬,2016
18,马克思主义/思想政治教育,南京农业大学,规划基金项目,大学生村官“讲好中国扶贫故事”研究,吴国清,2016
19,马克思主义/思想政治教育,南开大学,规划基金项目,改革开放以来思想政治教育学术史研究,武东生,2016
20,马克思主义/思想政治教育,青岛大学,规划基金项目,社会主义核心价值观融入大学生信仰教育研究,林希玲,2016
21,马克思主义/思想政治教育,厦门大学,规划基金项目,马克思主义道德观与道德相对主义批判,杨胜良,2016
22,马克思主义/思想政治教育,山东师范大学,规划基金项目,红四方面军长征史相关问题研究,董振平,2016
23,马克思主义/思想政治教育,深圳职业技术学院,规划基金项目,创新与共享视域下“思政”课新型教学模式实践探索研究,孙剑坪,2016
24,马克思主义/思想政治教育,沈阳航空航天大学,规划基金项目,推进国家治理现代化的价值观视角研究,王秀华,2016
25,马克思主义/思想政治教育,沈阳师范大学,规划基金项目,当代中国社会主义“资本”实践的合法性研究,刘润,2016
26,马克思主义/思想政治教育,天津理工大学,规划基金项目,转型期中国社会心态失衡现象研究,张九海,2016
27,马克思主义/思想政治教育,西安理工大学,规划基金项目,后马克思主义符号消费的意识形态批判研究,李军学,2016
28,马克思主义/思想政治教育,信阳农林学院,规划基金项目,“互联网+”条件下社会主义核心价值观认同机制与引领路经研究,敖翔,2016
29,马克思主义/思想政治教育,盐城师范学院,规划基金项目,中国绿色发展理念与国际认同研究,徐海红,2016
30,马克思主义/思想政治教育,长江师范学院,规划基金项目,湘鄂渝黔边民族地区红军遗址资源的调查、开发与利用研究,项福库,2016
31,马克思主义/思想政治教育,浙江大学,规划基金项目,高校心理健康教育与思想政治教育结合30年得失研究,马建青,2016
32,马克思主义/思想政治教育,中南民族大学,规划基金项目,仪式与认同：节庆文化中的价值观教育研究,曾红宇,2016
33,马克思主义/思想政治教育,安庆师范学院,青年基金项目,大学生思想政治教育整体性协同机制研究,邹斌,2016
34,马克思主义/思想政治教育,安庆师范学院,青年基金项目,激活与创新：中华元素与社会主义文化产业的建构,陈志超,2016
35,马克思主义/思想政治教育,北京科技大学,青年基金项目,当代中国互联网主流意识形态话语权建构研究,李江静,2016
36,马克思主义/思想政治教育,北京联合大学,青年基金项目,海外“中国崩溃论”的应对问题研究,刘佳,2016
37,马克思主义/思想政治教育,北京师范大学,青年基金项目,微公益时代的公民慈善及其实践模式研究,刘丹,2016
38,马克思主义/思想政治教育,大连海洋大学,青年基金项目,融媒体视阈下高校思想政治教育话语表达创新研究,冯文艳,2016
39,马克思主义/思想政治教育,大连理工大学,青年基金项目,内地高校新疆少数民族学生中华民族共同体意识培育研究,孙壮,2016
40,马克思主义/思想政治教育,东北师范大学,青年基金项目,大学生组织思想政治教育感染性研究,王子刚,2016
41,马克思主义/思想政治教育,福建师范大学,青年基金项目,互联网+条件下高校主流意识形态话语权问题研究,张一,2016
42,马克思主义/思想政治教育,广东金融学院,青年基金项目,西方政治哲学传统视阈下的马克思“政治—哲学”关系研究,刘华萍,2016
43,马克思主义/思想政治教育,广东警官学院,青年基金项目,马克思主义文化批判理论及其对中国文化发展的当代价值研究,卢文忠,2016
44,马克思主义/思想政治教育,海南经贸职业技术学院,青年基金项目,中越高校马克思主义理论课程体系与教学内容比较研究,罗文英,2016
45,马克思主义/思想政治教育,合肥工业大学,青年基金项目,微时代主流意识形态微传播机制与策略研究,郭芙蓉,2016
46,马克思主义/思想政治教育,河南科技大学,青年基金项目,坚持共享发展的制度保障机制研究,范迎春,2016
47,马克思主义/思想政治教育,河南理工大学,青年基金项目,中华优秀传统文化对社会主义核心价值观的涵养功能研究,王新刚,2016
48,马克思主义/思想政治教育,湖北工程学院,青年基金项目,精准扶贫中的国家治理现代化实践机制研究,贺海波,2016
49,马克思主义/思想政治教育,湖北汽车工业学院,青年基金项目,中国共产党领导下的冬学运动研究,周江平,2016
50,马克思主义/思想政治教育,湖北文理学院,青年基金项目,思想政治教育价值结构研究,王丽,2016
51,马克思主义/思想政治教育,湖南环境生物职业技术学院,青年基金项目,新常态下大学生生态伦理教育的路径创新研究,肖明,2016
52,马克思主义/思想政治教育,华南农业大学,青年基金项目,系统工具视角国家治理体系内部协同机制研究,张君弟,2016
53,马克思主义/思想政治教育,华南农业大学,青年基金项目,五大发展理念的内在逻辑与方法创新研究,程华,2016
54,马克思主义/思想政治教育,华中农业大学,青年基金项目,“有机马克思主义”历史观研究,但昭明,2016
55,马克思主义/思想政治教育,吉林大学,青年基金项目,新常态下我国劳动关系协调机制创新与国际比较研究,张嘉昕,2016
56,马克思主义/思想政治教育,嘉兴学院,青年基金项目,基于马克思劳动理论的劳动关系评价指标体系研究,陆文荣,2016
57,马克思主义/思想政治教育,嘉兴学院,青年基金项目,中国共产党党内关系的百年治理：历史演进与基本经验,马赛,2016
58,马克思主义/思想政治教育,江南大学,青年基金项目,美国高校通识教育的意识形态话语机制研究,蔡瑶,2016
59,马克思主义/思想政治教育,江西师范大学,青年基金项目,马克思正义思想及其当代境遇研究,蓝春娣,2016
60,马克思主义/思想政治教育,临沂大学,青年基金项目,《群众》周刊建构中国共产党公信形象的文本研究（1937-1949）,刘涛,2016
61,马克思主义/思想政治教育,南通大学,青年基金项目,领导干部家风建设研究,吴世丽,2016
62,马克思主义/思想政治教育,内蒙古科技大学,青年基金项目,思想政治教育学理论基础的建构逻辑研究,王爱莲,2016
63,马克思主义/思想政治教育,曲阜师范大学,青年基金项目,优秀传统文化视阈下当代大学生意识形态教育路径研究,陈敏,2016
64,马克思主义/思想政治教育,厦门大学,青年基金项目,马克思正义理论视域下共享发展理念及其实践路径研究,苗瑞丹,2016
65,马克思主义/思想政治教育,山东大学,青年基金项目,新世纪以来高校思想政治教育政策绩效研究,郑敬斌,2016
66,马克思主义/思想政治教育,山东大学,青年基金项目,埃里克·赖特的社会主义新规划研究,马莲,2016
67,马克思主义/思想政治教育,山西大学,青年基金项目,马克思主义中国化的元问题反思与整体性论证研究,尹占文,2016
68,马克思主义/思想政治教育,山西师范大学,青年基金项目,当代西方左翼学者的技术政治观研究,黄雪丽,2016
69,马克思主义/思想政治教育,上海体育学院,青年基金项目,主流意识形态在微媒体场域的传播效度研究,胡德平,2016
70,马克思主义/思想政治教育,深圳大学,青年基金项目,生态正义问题制度之维研究,郑湘萍,2016
71,马克思主义/思想政治教育,沈阳师范大学,青年基金项目,改革开放以来党的统一战线理论创新研究,张德明,2016
72,马克思主义/思想政治教育,顺德职业技术学院,青年基金项目,网困：互联网时代休闲异化问题研究,肖薇薇,2016
73,马克思主义/思想政治教育,四川大学,青年基金项目,宗教网络传播对新社会阶层信仰的影响及对策研究,薛一飞,2016
74,马克思主义/思想政治教育,太原理工大学,青年基金项目,当代农民财富伦理观的价值取向与引导路径研究,侯红霞,2016
75,马克思主义/思想政治教育,五邑大学,青年基金项目,港澳青年国家认同研究,曾祥春,2016
76,马克思主义/思想政治教育,武汉大学,青年基金项目,中国共产党意识形态话语权的生成逻辑与发展路径研究,史姗姗,2016
77,马克思主义/思想政治教育,武汉工程大学,青年基金项目,当代中国法治教育的社会参与机制构建研究,帅颖,2016
78,马克思主义/思想政治教育,西安电子科技大学,青年基金项目,知识教育与德性教育的内在机理及转化机制研究,蒋冬双,2016
79,马克思主义/思想政治教育,西安电子科技大学,青年基金项目,绿色发展理念下的社会主义生态文明建设研究,李垣,2016
80,马克思主义/思想政治教育,西安交通大学,青年基金项目,大学生国家安全观念及其安全化路径研究,刘玉青,2016
81,马克思主义/思想政治教育,西北工业大学,青年基金项目,全面从严治党背景下中国共产党政治规矩研究,李鹏,2016
82,马克思主义/思想政治教育,西藏民族大学,青年基金项目,马克思恩格斯“论中国”研究,王东红,2016
83,马克思主义/思想政治教育,浙江工商大学,青年基金项目,比较公民教育视域下的参与式公益研究,于希勇,2016
84,马克思主义/思想政治教育,浙江旅游职业学院,青年基金项目,全面从严治党下的党风廉政建设问责制研究,胡洪彬,2016
85,马克思主义/思想政治教育,浙江师范大学,青年基金项目,传统家训中的德育思想及其当代转化研究,姜玉峰,2016
86,马克思主义/思想政治教育,郑州成功财经学院,青年基金项目,台湾地区高校通识教育的特色及其对大陆高等教育的启示,李海容,2016
87,马克思主义/思想政治教育,中国矿业大学,青年基金项目,思想政治教育对儒学教化的当代引领研究,张世亮,2016
88,马克思主义/思想政治教育,中国矿业大学,青年基金项目,20世纪上半叶非中共知识群体马克思主义理论传播与接受研究,胡可涛,2016
89,马克思主义/思想政治教育,中国人民公安大学,青年基金项目,印度社会主义运动研究：以印度共产党(马克思主义)为视角,禚明亮,2016
90,马克思主义/思想政治教育,重庆文理学院,青年基金项目,大学生柔性管理“六步进阶”运行机制构建研究,胡在东,2016
91,哲学,复旦大学,规划基金项目,杜威价值哲学研究,冯平,2016
92,哲学,河南科技大学,规划基金项目,我国社会公正的评价体系研究,彭富明,2016
93,哲学,华中科技大学,规划基金项目,伽达默尔与施特劳斯之争,何卫平,2016
94,哲学,南开大学,规划基金项目,自然审美批评话语之建构,薛富兴,2016
95,哲学,中山大学,规划基金项目,当代英美马克思主义正义理论谱系研究,林育川,2016
96,哲学,中山大学,规划基金项目,施泰因交互主体性现象学研究,郁欣,2016
97,哲学,北京化工大学,青年基金项目,莱布尼茨科学符号理论及其价值研究,郭菁,2016
98,哲学,北京林业大学,青年基金项目,古典博物学时期的自然经济思想,徐保军,2016
99,哲学,大连理工大学,青年基金项目,从身心交互论的视角研究康德意志自由的思想,仇彦斌,2016
100,哲学,东北师范大学,青年基金项目,柏拉图《泰阿泰德篇》研究,李守利,2016
101,哲学,东南大学,青年基金项目,当代美德伦理学中的正义问题研究,孙会娟,2016
102,哲学,佛山科学技术学院,青年基金项目,《抱朴子外篇》思想研究,管丽珺,2016
103,哲学,复旦大学,青年基金项目,阿尔都塞与当代激进政治哲学,林青,2016
104,哲学,广东外语外贸大学,青年基金项目,伯恩施坦与考茨基思想比较研究——以二者通信（1879-1932）为中心的考察,练建玲,2016
105,哲学,广州大学,青年基金项目,灾难与仁学——中国传统哲学视域下的灾难哲学建构,赵楠楠,2016
106,哲学,海南大学,青年基金项目,道德责任归因中的运气问题研究,赵静波,2016
107,哲学,菏泽学院,青年基金项目,中世纪基督教对待科学态度的珍本原典文献研究,张志伟,2016
108,哲学,湖南科技大学,青年基金项目,理学视域下的南宋史评学研究,刘依平,2016
109,哲学,华东政法大学,青年基金项目,“美”的政治哲学探源：柏拉图《希琵阿斯前后篇》的翻译、集注和义疏,王江涛,2016
110,哲学,华南农业大学,青年基金项目,《左传》“以礼解经”研究,王竹波,2016
111,哲学,华中科技大学,青年基金项目,中国近现代哲学中的形而上学问题研究,廖晓炜,2016
112,哲学,江南大学,青年基金项目,政治哲学中的“康德式”建构主义理论研究,张祖辽,2016
113,哲学,南京大学,青年基金项目,斯洛特戴克批判理论研究,常晅,2016
114,哲学,南京林业大学,青年基金项目,怀疑与论证：新摩尔主义研究,杨修志,2016
115,哲学,南开大学,青年基金项目,二十世纪德法哲学视野中的形而上学问题,安靖,2016
116,哲学,山西师范大学,青年基金项目,德里达中期哲学研究,张振东,2016
117,哲学,上海财经大学,青年基金项目,福柯身体观及其在女性主义视域内的展开,周冏,2016
118,哲学,上海财经大学,青年基金项目,金融化生存世界中的经济正义研究,严静峰,2016
119,哲学,深圳大学,青年基金项目,关于可能世界的反实在论研究,葛欢欢,2016
120,哲学,太原科技大学,青年基金项目,科学认知中的信息演化研究,卫郭敏,2016
121,哲学,西安翻译学院,青年基金项目,金融化：21世纪资本权力的经济哲学批判,宁殿霞,2016
122,哲学,西安邮电大学,青年基金项目,分析哲学思想的溯源研究——从康德、波尔查诺到弗雷格,王策,2016
123,哲学,西安邮电大学,青年基金项目,张载《经学理窟》校注及其经学思想研究,邸利平,2016
124,哲学,西南大学,青年基金项目,中国古代都市在美学研究中的位置——以西汉长安为例,张雨,2016
125,哲学,浙江大学,青年基金项目,亚里士多德《论灵魂》的翻译与研究,陈玮,2016
126,哲学,中国矿业大学,青年基金项目,身体的设计与构建：身体干预技术的哲学研究,张灿,2016
127,哲学,中国石油大学（华东）,青年基金项目,金元春秋学研究,张欣,2016
128,哲学,中山大学,青年基金项目,人格、自由和尊严：“Persona”概念在中世纪的发展,江璐,2016
129,逻辑学,燕山大学,青年基金项目,现代归纳逻辑的科学与哲学认知基础及应用研究,王磊,2016
130,逻辑学,中山大学,青年基金项目,基于非精确概率逻辑的博弈问题研究,刘海林,2016
131,宗教学,复旦大学,规划基金项目,亚洲地缘宗教格局与中国周边安全、外交,涂怡超,2016
132,宗教学,内蒙古民族大学,规划基金项目,蒙古文《金光明经》佛源语词研究,乌力吉套格套,2016
133,宗教学,天津外国语大学,规划基金项目,当代美国道教学研究,蔡觉敏,2016
134,宗教学,北京外国语大学,青年基金项目,佛经《虎耳譬喻经》梵藏汉文献整理与研究,周利群,2016
135,宗教学,广西民族大学,青年基金项目,越南民间信仰中的中越共同神研究,韦凡州,2016
136,宗教学,衡阳师范学院,青年基金项目,恩格斯基督教研究的研究,李栋材,2016
137,宗教学,四川大学,青年基金项目,凉山木里藏族宗教文化调查研究,完德加,2016
138,宗教学,西安外国语大学,青年基金项目,早期汉语《圣经》对勘研究及其对中国文化的影响,王硕丰,2016
139,宗教学,西南大学,青年基金项目,《鸠摩罗什法师大义》研究,解兴华,2016
140,宗教学,新疆大学,青年基金项目,中亚国家宗教去极端化措施研究,齐那尔·阿不都沙力克,2016
141,宗教学,重庆师范大学,青年基金项目,明清时期聚云派禅学文献整理与研究,华海燕,2016
142,语言学,安徽工业大学,规划基金项目,法家经典文献在英语世界的译介与传播研究,戴拥军,2016
143,语言学,安庆师范学院,规划基金项目,社会语言学视角下黄梅戏经典剧目舞台道白研究,鲍红,2016
144,语言学,北京交通大学,规划基金项目,晚清传教士西学翻译与西方近代启蒙思想的译介,卢明玉,2016
145,语言学,北京师范大学,规划基金项目,中小学生英语阅读能力标准及测评体系研究,程晓堂,2016
146,语言学,北京师范大学,规划基金项目,基于语篇体裁类型的教育语篇知识结构研究,于晖,2016
147,语言学,北京语言大学,规划基金项目,大数据背景下的词汇计量与常用词库建设,王治敏,2016
148,语言学,北京语言大学,规划基金项目,“介引”类离合词及其语用接口研究,李春玲,2016
149,语言学,常州大学,规划基金项目,跨文化传播视域下的《孔子家语》英译研究,伊咏,2016
150,语言学,常州工学院,规划基金项目,语言接触与中古汉译佛经称谓语研究,鞠彩萍,2016
151,语言学,大连外国语大学,规划基金项目,三语习得视域下内地维吾尔族学生英语学习中的语用迁移研究,朱效惠,2016
152,语言学,东北师范大学,规划基金项目,语境的经验性与本体性关系研究,于林龙,2016
153,语言学,福建工程学院,规划基金项目,英语介词误用的认知探讨：基于语料库的研究,左尚君,2016
154,语言学,复旦大学,规划基金项目,修辞学视角的汉语违实表达研究,霍四通,2016
155,语言学,广东金融学院,规划基金项目,晋冀豫毗连地带晋语语法系统研究,谷向伟,2016
156,语言学,广东外语外贸大学,规划基金项目,外国留学生汉语写作“互动协同”教学模式构建,郝红艳,2016
157,语言学,哈尔滨工程大学,规划基金项目,学术语篇中批评言语行为的互文性分析,邓晓明,2016
158,语言学,哈尔滨理工大学,规划基金项目,语言学视角下失语症患者语块能力康复状况的跟踪研究,周荣,2016
159,语言学,合肥工业大学,规划基金项目,《文心雕龙》核心思想英译及其对外传播研究,胡作友,2016
160,语言学,湖南第一师范学院,规划基金项目,动词论元结构在中文信息抽取中的应用研究,肖升,2016
161,语言学,湖南科技大学,规划基金项目,常德沧山话词汇研究,徐前师,2016
162,语言学,湖州师范学院,规划基金项目,日语口译语用失误体系研究,金翰钧,2016
163,语言学,华东交通大学,规划基金项目,基于语料库与心理实验的中国英语学习者隐喻性词义习得比较研究,石进芳,2016
164,语言学,华南理工大学,规划基金项目,基于社会文化理论的二语写作认知研究,雷霄,2016
165,语言学,华中师范大学,规划基金项目,基于大规模“微信”文本语料库的汉语会话分析,余一骄,2016
166,语言学,华中师范大学,规划基金项目,非母语者汉语有标复句习得难度级差及教学模式实证研究,万莹,2016
167,语言学,华中师范大学,规划基金项目,英语学习者劝说性文体中的语篇修辞研究,刘东虹,2016
168,语言学,淮阴师范学院,规划基金项目,近代汉语词汇对《汉语大词典》书证研究,王毅,2016
169,语言学,淮阴师范学院,规划基金项目,周恩来外交修辞创意研究,解正明,2016
170,语言学,吉林大学,规划基金项目,出土两汉杂器铭文整理与研究,徐正考,2016
171,语言学,聊城大学,规划基金项目,英汉非线性构式对比研究,李维滨,2016
172,语言学,南京师范大学,规划基金项目,《敦煌俗字典》修订本,黄征,2016
173,语言学,南京晓庄学院,规划基金项目,联合国教科文组织语言规划观及其中国实践研究,方小兵,2016
174,语言学,宁波大学,规划基金项目,基于语料库的关系词语用于单句现象再研究,聂仁发,2016
175,语言学,厦门理工学院,规划基金项目,基于CCAT的世界遗产翻译研究,余军,2016
176,语言学,山东工商学院,规划基金项目,汉英双语者视、听信息组构化加工模式研究,张拥政,2016
177,语言学,山东科技大学,规划基金项目,《官话指南》多版本语言比较研究,徐丽,2016
178,语言学,陕西理工学院,规划基金项目,小句认知结构与句法结构关系研究,丁力,2016
179,语言学,上海财经大学,规划基金项目,基于讲说体白话文献的清至民初汉语口语句式研究,卢惠惠,2016
180,语言学,上海交通大学,规划基金项目,史华慈-吴漠汀《红楼梦》120回德文全译本研究,王金波,2016
181,语言学,上海外国语大学,规划基金项目,历时视角下的“汉语-突厥语”语言接触研究,王艳红,2016
182,语言学,首都师范大学,规划基金项目,汉日时制构造的比较研究,孙伟,2016
183,语言学,四川大学,规划基金项目,英语语境下中国留学生英语口头学术语篇的社会化研究,左红珊,2016
184,语言学,四川师范大学,规划基金项目,印度传统医学阿育吠陀词汇的梵-拉-英-汉对照数据库构建与研究,程树华,2016
185,语言学,同济大学,规划基金项目,中国学习者学术英语写作语料库建设与研究,盛云岚,2016
186,语言学,新疆师范高等专科学校,规划基金项目,现代哈萨克语表达语气意义的语调实验研究,魏炜,2016
187,语言学,扬州大学,规划基金项目,汉语国际推广中的中国文化符号国际认同研究,陈莉,2016
188,语言学,长江大学,规划基金项目,荆楚方言词汇研究,吴松,2016
189,语言学,浙江工商大学,规划基金项目,异读视角下的上古汉语句法结构之差异,王月婷,2016
190,语言学,浙江师范大学,规划基金项目,理雅各《诗经》英译注释话语特征及其对中国经典“走出去”的启示,胡美馨,2016
191,语言学,中南财经政法大学,规划基金项目,现代华人离散译者的身份博弈对其文化译介思想的影响研究,汪世蓉,2016
192,语言学,重庆工商大学,规划基金项目,动态系统理论视域下二语学习动机的回溯与跟踪研究,戴运财,2016
193,语言学,重庆交通大学,规划基金项目,跨学科视角的抗战时期军事翻译研究,罗天,2016
194,语言学,安徽农业大学,青年基金项目,长三角地区农业转移人口子女语言融合研究,刘艳,2016
195,语言学,北京大学,青年基金项目,大数据下语义知识资源的覆盖度和扩展性研究,卢达威,2016
196,语言学,北京第二外国语学院,青年基金项目,基于汉俄平行语料库的政治文献翻策略研究,刘淼,2016
